"Holburn,Guy L.F. ","BA Cambridge; MA, PhD California at Berkeley; ",Engineering WindEEE ,Associate Professor ,"Holburn,Guy L.F. ","BA Cambridge; MA, Ph.D. California at Berkeley; ",Business - Associate Dean ,Associate Professor ,"Hopkins,Jeff Slater Patrick ","BA, MA ; Ph.D. McGill; ",Geography ,Associate Professor ,"Horak,Martin ",BA McGill; Ph.D. Toronto; ,Political Science ,Associate Professor ,Program Director "Houde,Martin ","BEng, MSc, Ph.D. Montreal; ",Physics and Astronomy ,Associate Professor ,"Huey,Laura ","BA Simon Fraser BC, Ph.D. U of BC ",Sociology ,Associate Professor ,"Hutter,Jeffrey L ","BA BC, Ph.D. Simon Fraser Univ BC ",Physics and Astronomy/Science - Office of the ,Associate Professor ,Associate Dean (Acad Programs) "Irwin,Jennifer D. ",BA Wilfrid Laurier; MA Dalhousie; Ph.D. Waterloo; ,School of Health Studies ,Associate Professor ,"James,Joy ","MFA, Ph.D. UBC ",Visual Arts ,Associate Professor ,Department Chair "Jared,Debra J ","BA, BEd Queen's; MA, Ph.D. McGill; ",Psychology ,Associate Professor ,"Jenkyn,Thomas R. ","BASC, MASc, Ph.D. ; ",Mechanical & Materials/Biomed Eng Interdis Grad Prog ,Associate Professor ,"Jenkyn,Thomas R. ","BASC, MASc, Ph.D. ; ",Kinesiology - General ,Associate Professor ,"Jennings,Mary-Beth ","B.A.(Hons) Laurentian, MCISc, Ph.D. ",Communicative Sci & Disorders/National Centre for Audiology ,Associate Professor ,"Jiang,Dazhi ","BScEng, MSc Hefei (China); Ph.D. New Brunswick; ",Earth Sciences ,Associate Professor ,"Jiang,Liying ","BSc, China; Ph.D., Alberta ",Mechanical & Materials ,Associate Professor ,"Joanisse,Marc ","BA McGill; MA, Ph.D. University of Soutern California; ",Psychology ,Associate Professor ,"Johnson,Andrew M ","BA(HONS), MA, Ph.D. Western; ",School of Health Studies/Health & Rehab Sciences Prgm ,Associate Professor ,"Johnson,Catherine A ",BA New Brunswick; MA Dalhousie; Ph.D. Toronto; ,Info & Media Studies - General ,Associate Professor ,"Jones,Carol E. ","BSc, MSc, Ph.D. ; ",Physics and Astronomy/Science - Office of the ,Associate Professor ,"Associate Dean (Grad,PostDoc) ""Jones,Charles W.B. ","BA Toronto; MA Windsor; MPHIL, Ph.D. London; ",Political Science ,Associate Professor ,Department Chair "Jorgensen,Dan W ",BA San Fernando Valley; Ph.D. British Columbia; ,Anthropology ,Associate Professor ,Department Chair "Katchabaw,Mike ","BA Ontario, Ph.D. Western ",Computer Science ,Associate Professor ,"Keep,Christopher ","BA, MA York; Ph.D. Queen's; ",English ,Associate Professor ,"Keep,Christopher ","BA, MA York; Ph.D. Queen's; ",Theory&Criticism ID Grad Prog ,Associate Professor ,"Kehler,Michael Duncan ","BA, BEd Queen's; MEd ; Ph.D. Michigan; ",Womens' Studies ,Associate Professor ,"Kehler,Michael Duncan ","BA, BEd Queen's; MEd ; Ph.D. Michigan; ",Education - Office of the Dean ,Associate Professor ,"Keightley,Keir ","BA, MA McGill; Ph.D. Concordia; ",Info & Media Studies - General ,Associate Professor ,"Kellow,Margaret R ","BA, MA, Western; MPHIL, Ph.D. Yale ",History ,Associate Professor ,"Kermani,Mehrdad Radji ","BSc, MSc Iran; Ph.D. London; ",Electrical & Computer ,Associate Professor ,"Kertoy,Marilyn K ",BA Ohio State; MA Western Michigan; Ph.D. Wisconsin; ,Communicative Sci & Disorders ,Associate Professor ,School Director "Keyghobadi,Nusha ",BSc Toronto; Ph.D. Alberta ,Department of Biology ,Associate Professor ,"Khimji,Mohamed F ","LLB U of Bristol NS, LLM London School of Economic ",Law - Office of the Dean ,Associate Professor ,"Kim,Sung O ",Ph.D. at UBC ,Microbiology & Immunology ,Associate Professor ,"King,Michael Robert ",BACS Queen's; Ph.D. London School of Economic GBR ,Business - Associate Dean ,Associate Professor ,"Kinsella,Elizabeth Anne ","BSc(OT) Toronto, MA Ed. St. Fx; Ph.D.. ",Womens' Studies ,Associate Professor ,"Kinsella,Elizabeth Anne ","BSc(OT) Toronto, MA Ed. St. Fx; Ph.D.. ",Occupational Therapy ,Associate Professor ,"Klar,Neil Steven ",BSc MSc at MCGILL ; Ph.D. at Western ; MMath at WATERLOO ,Epidemiology and Biostatistics ,Associate Professor ,"Klassen,Robert Jay ","BSc, MSc Manitoba; Ph.D. Toronto; P.Eng. ",Mechanical & Materials ,Associate Professor ,Associate Chair "Klein,Perry D ","BEd, BSc, Ph.D. Toronto; MA York; ",Education - Office of the Dean ,Associate Professor ,"Klimchuk,Dennis ","BA, MA Manitoba; Ph.D. Toronto; ",Philosophy ,Associate Professor ,"Kloseck,Marita Hedwig ",BAA Central Michigan; MSc Oklahoma State U; Ph.D. Waterloo; ,School of Health Studies ,Associate Professor ,School Director "Kloseck,Marita Hedwig ",BAA Central Michigan; MSc Oklahoma State U; Ph.D. Waterloo; ,Department of Medicine ,Associate Professor ,"Kohalmi,Susanne E. ",DIPLOM J.-W. Goethe; Ph.D. Manitoba; ,Department of Biology ,Associate Professor ,"Kohler,Stefan ",DIPLOM Universitat Bielefeld; Ph.D. Toronto; ,Psychology ,Associate Professor ,"Kohr,Rosemary ","BA, MA Ontario, Doctoral Degree U of Alberta ",Nursing ,Associate Professor ,"Kostal,Rande W ",LLB Western; OF THE LAW SOCIETY OF UPPER CANADA ; MA McMaster; Ph.D. Oxford; ,Business - Associate Dean ,Associate Professor ,"Kothari,Anita ","BSc, MHSc Toronto; Ph.D. McMaster; ",School of Health Studies ,Associate Professor ,"Kothari,Anita ","BSc, MHSc Toronto; Ph.D. McMaster; ",Epidemiology and Biostatistics ,Associate Professor ,"Koval,Susan F ",Ph.D. at LONDON ; MSc at Western ; BSc at WATERLOO ,Microbiology & Immunology ,Associate Professor ,"Lacefield,James C. ","BSE, PhD, Duke; P.Eng. ",Electrical & Computer ,Associate Professor ,"Lacefield,James C. ","BSE, Ph.D., Duke; P.Eng. ",Medical Biophysics ,Associate Professor ,"Ladak,Hanif M. ","BASC, Toronto; MEng, Ph.D., McGill; P.Eng. ",Electrical & Computer ,Associate Professor ,"Ladak,Hanif M. ","BASC, Toronto; MEng, Ph.D., McGill; P.Eng. ",National Centre for Audiology ,Associate Professor ,"Ladak,Hanif M. ","BASC, Toronto; MEng, Ph.D., McGill; P.Eng. ",Otolaryngology/Medical Biophysics ,Associate Professor ,"Laforet-Fliesser,Yvette ",MA Ontario ,Nursing ,Associate Professor ,"Lagerlund,Henrik ","BA, MA, Ph.D. Uppsala; ",Philosophy ,Associate Professor ,Department Chair "Lagugne-Labarthet,Francois ","BSc Bordeaux France, Ph.D. Bordeaux France ",Chemistry/Physics and Astronomy/Nanofabric ,Associate Professor ,"Lamarche,Jacques ","BA, MA, Ph.D. UQUAM; ",French Studies ,Associate Professor ,"Larsen,Marianne A. ","BA Toronto, BEd Mount St Allison, MA, Ph.D. London England ",Education - Office of the Dean ,Associate Professor ,"Laviolette,Steven R ",BSc Ph.D. at TORONTO ,Anatomy & Cell Biology/Psychiatry ,Associate Professor ,"Lawson-Hellu,Late B. ",BA Nye_konakpoe_; MA Be_nin; Ph.D. Ottawa; ,French Studies ,Associate Professor ,"Leask,Andrew ",Ph.D. at CHICAGO ; BSc at UBC ,Physiology and Pharmacology/Dentistry ,Associate Professor ,"Leclerc,Jean ","BA, MA UQTR; Ph.D. UQAM/Paris Sorbonne ",French Studies ,Associate Professor ,"Lee,Alison M ","BA, MA, Ph.D. McMaster; ",English ,Associate Professor ,"Lee,Christopher James ","BA Brock; MA, Ph.D. ; ",School of Health Studies ,Associate Professor ,"Lehmann,Wolfgang ",MA OISE; MBA New York; Ph.D. Alberta; ,Sociology ,Associate Professor ,"Leipert,Beverly D ","BA, BScN, RegN Saskatchewan; MScN UBC; Ph.D. Alberta; ",Nursing ,Associate Professor ,"Lemire,Nicole ","BSc Windsor; MSc, Ph.D. Alberta; ",Mathematics ,Associate Professor ,"Levin,Simon D ",FRCPCan MBChB at BIRMINGHAM ,Clinical Neurological Science/Paediatrics ,Associate Professor ,"Levine,Charles G ","BA, MA McMaster; Ph.D. Alberta; ",Sociology ,Associate Professor ,Undergraduate Chair "Li,Shun-Cheng ",BSc at PEKING ; MSc at SHANGHAI ; Ph.D. at TORONTO ,Oncology/Biochemistry ,Associate Professor ,"Ling,Hong ",Ph.D. at ALBERTA ; BS MS at GEOSCIENCES ,Biochemistry ,Associate Professor ,"Linn,Thomas G ",Ph.D. at HARVARD ; BSc at MINNESOTA ,Microbiology & Immunology ,Associate Professor ,"Linnen,Robert ","BSc Queen's; MSc, Ph.D. McGill ",Earth Sciences ,Associate Professor ,"Liu,Xiaoming ","BSc Nanchang Inst China, Ph.D. Univ of Toronto ",Statistics & Actuarial Science ,Associate Professor ,"Livshits,Igor D ","BS, MS Belarusian State Polytechnic Academy; MS Illinois Urbana-Champaign; Ph.D. Minnesota; ",Economics ,Associate Professor ,Graduate Chair "Lock,Michael ",HBSc MD at MCMASTER ; CCFP FRCPCan at TORONTO ,Medical Biophysics/Oncology ,Associate Professor ,"Lomber,Stephen ","BS U of Rochester, Ph.D. Boston Univ ",National Centre for Audiology ,Associate Professor ,"Long,Douglas G ","BA, MA Toronto; Ph.D. London; ",Political Science ,Associate Professor ,"Longtin,Mario ",BA; MA McGill; MSc Ph.D. Universite_ d'Edinburg; ,French Studies ,Associate Professor ,"Lucy,Deborah S ","BSc(PT), MCLSC, Ph.D. ; ",Physical Therapy ,Associate Professor ,School Director "Luginaah,Isaac ",BSc; MSc; MES; Ph.D. McMaster; ,Geography ,Associate Professor ,"Lui,Edmund M ",BSc MSc Ph.D. at DALHOUSIE ,Physiology and Pharmacology ,Associate Professor ,"Lupovitch,Howard ","BA U of Michigan, Ph.D. Columbia Univ USA ",History ,Associate Professor ,"Lynk,S. Michael ","BA, LLB Dalhousie; LLM Queen's; OF THE LAW SOCIETY OF UPPER CANADA AND THE NOVA SCOTIA BARRISTERS' SOCIETY ; ",Law - Office of the Dean ,Associate Professor ,"MacDougall Shackleton,Elizabeth ",Ph.D. Princeton Univ ,Department of Biology ,Associate Professor ,"MacDougall,Robert ","BA Queen's; MA, Ph.D. Harvard; ",History ,Associate Professor ,Graduate Chair "MacEachern,Alan ","BA P.E.I.; MA, Ph.D. Queen's; ",History ,Associate Professor ,"Macfie,Sheila M. ","BSc, MSc Queen's; Ph.D. Alberta; Faculty of Science Teaching Excellence Award (2002); The Marilyn Robinson Award for Excellence in Teaching (2003); ",Department of Biology ,Associate Professor ,"MacGee,Jim ","BBA, MA New Brunswick; Ph.D. Minnesota; ",Economics ,Associate Professor ,Program Director "Magalhaes,Lilian ","BOT, MEd, Ph.D., Brazil; ",Womens' Studies ,Associate Professor ,"Magalhaes,Lilian ","BOT, MEd, Ph.D., Brazil; ",Occupational Therapy ,Associate Professor ,"Mamandras,Antonios H ",DDS at ATHENS ; MSc at MANITOBA ,Dentistry ,Associate Professor ,Graduate Chair "Mamon,Rogemar S ","BSc U of Philippines, Ph.D. U of Alberta ",Statistics & Actuarial Science ,Associate Professor ,"Mann,Mellissa Rae ",Ph.D. at TORONTO ; BSc MSc at Western ,Biochemistry/Obstetrics & Gynaecology ,Associate Professor ,"Mansur,Salim ","BA, MA, Ph.D. Toronto; ",Political Science ,Associate Professor ,"Marsh,Greg D ","BA, BEd, MA, Ph.D.; ",Kinesiology - General ,Associate Professor ,"Marsh,Greg D ","BA, BEd, MA, Ph.D.; ",Medical Biophysics ,Associate Professor ,"Maxwell,Denis P ","BSc, Ph.D. ; ",Department of Biology ,Associate Professor ,"May,Allyson ",BA MLS MA Ph.D. Toronto; ,History ,Associate Professor ,"McCormick,John ",Ph.D. at ALBERTA ; BSc at Queen's ,Microbiology & Immunology ,Associate Professor ,"McDayter,Mark ","BA, MA, Ph.D. Toronto; ",English ,Associate Professor ,"McGavin,Martin ",BSc U of Guelph; Ph.D. U of Guelph ,Department of Medicine/Microbiology & Immunology ,Associate Professor ,"McGlynn,Margaret ","BA, MPhil, University College College Dublin; Ph.D. Toronto ",History ,Associate Professor ,Undergraduate Chair "McIsaac,Kenneth ","BASC Waterloo; MSc, Ph.D., University of Pennsylvania; P.Eng. ",Electrical & Computer ,Associate Professor ,Department Chair "McKellar,Shelley ",BA Ottawa; MA McMaster; Ph.D. Toronto; ,Surgery ,Associate Professor ,"McKellar,Shelley ",BA Ottawa; MA McMaster; Ph.D. Toronto; ,History ,Associate Professor ,"McKenna,Katherine M ","BA, MA, Ph.D. Queen's; ",Womens' Studies ,Associate Professor ,Graduate Chair "McKenna,Katherine M ","BA, MA, Ph.D. Queen's; ",History ,Associate Professor ,"McKenzie,Charles Alexander ",BSc at UBC ; Ph.D. at Western ,Medical Biophysics/Department of Medical Imaging ,Associate Professor ,"McKenzie,Charles Alexander ",BSc at UBC ; Ph.D. at Western ,Physics and Astronomy ,Associate Professor ,"McKenzie,Francine ","BA, MA, Toronto; Ph.D. Cambridge ",History ,Associate Professor ,"McKenzie,Pamela Jane ","BA Toronto; MA New Brunswick; MLIS, Ph.D. Western; ",Womens' Studies ,Associate Professor ,"McKenzie,Pamela Jane ","BA Toronto; MA New Brunswick; MLIS, Ph.D. Western; ",Info & Media Studies - General ,Associate Professor ,Associate Dean "McLeod,Carolyn ","BA, MA Queen's; Ph.D. Dalhousie; ",Philosophy ,Associate Professor ,"McMurran,Mary Helen ",BA St. John's; MA; Ph.D. NYU ,English ,Associate Professor ,"McNay,Margaret ","BEd, Ph.D. British Columbia; MEd Western Washington; ",Education - Office of the Dean ,Associate Professor ,Associate Dean (Ugrd Program) "Meister,Darren ","BASC, MASc, Ph.D. Waterloo; DIPCS Cambridge; ",Business - Associate Dean ,Associate Professor ,"Menor,Lawrence Jon ",BA Washington; MBA Wisconsin-Madison; Ph.D. N. Carolina; ,Business - Associate Dean ,Associate Professor ,"Mequanint,Kibret ","BSc, MSc, Ph.D., Stellenbosch; ",Chemical &Biochem Engineering ,Associate Professor ,Associate Chair "Merrifield,Peter Allan ",BSc at CONCORDIA ; Ph.D. at Western ,Anatomy & Cell Biology ,Associate Professor ,"Milde,Michael ",Ph.D. U of Calgary ,Arts - Office of the Dean ,Associate Professor ,Dean "Millaire,Jean-Francois ",BA Laval; MA Montral; Ph.D. University of East Anglia UK ,Anthropology ,Associate Professor ,"Millard,Rodney ",BA Carleton; MA Waterloo; Ph.D. Toronto; ,History ,Associate Professor ,"Miller,Bradley W ","BComm, LLB UBC; LLM Edinburgh; DPhil Oxford; ",Law - Office of the Dean ,Associate Professor ,"Miller,James L ","BA, MA Oxon; BA York(Can); MA, Ph.D. Toronto ",Modern Languages & Literatures ,Associate Professor ,"Milligan,Louise ","BSc, Ph.D. McMaster; ",Science - Office of the Dean ,Associate Professor ,Associate Dean(Administration) "Millman,Brock Andrew ","BA, MA London; Ph.D. McGill; ",History ,Associate Professor ,"Minda,John Paul ",BA Hiram College; MA Bucknell University; Ph.D. State U of NY at Buffalo; ,Psychology ,Associate Professor ,"Mitchell,Beth ","BA, Ph.D. USA ",Paediatrics/Psychiatry ,Associate Professor ,"Mitchell,Derek ",BA at UBC ; Ph.D. at UNI-COL-LONDON ,Psychiatry ,Associate Professor ,"Moist,Louise Maureen ",FRCP MD at MCMASTER ; BScPhm at TORONTO ; MSc at Western ,Epidemiology and Biostatistics/Department of Medicine ,Associate Professor ,"Mok,Diana K ","B. Math, B.E.S. Waterloo; M.Pl. Queen's; Ph.D Toronto; ",Geography/Bachelor of Mgmt & Org Studies ,Associate Professor ,"Moll,Richard ","BA York University; MA, Ph.D. Toronto; ",English ,Associate Professor ,"Montano,Rafael ","BA Concordia; MA, Ph.D. McGill; ",Modern Languages & Literatures ,Associate Professor ,"Moodie,Kim Owen ",BA Western; MFA Concordia; ,Visual Arts ,Associate Professor ,"Mooney,Kevin ","BMUS UBC; MA, MPHIL, Ph.D. Columbia; ",Music - Office of the Dean ,Associate Professor ,"More,Roger A ","BSc Alberta; MBA, Ph.D. Western; ",Business - Associate Dean ,Associate Professor ,"Moreno Maza,Marc ","MA France, Ph.D. Paris U France ",Applied Mathematics/Computer Science ,Associate Professor ,"Morse,Eric ","BS Industrial Eng; MBA, Ph.D. Texas Tech; ",Business - Associate Dean ,Associate Professor ,Associate Dean (Ugrd Program) "Morton,Bruce ","BA, BSc McMaster; MA, Ph.D. Toronto; ",Psychology ,Associate Professor ,"Moschopoulos,Gerasimos ","BEng, MASc, Ph.D., Concordia; P.Eng. ",Electrical & Computer ,Associate Professor ,"Moser,Desmond ","BSc, Ph.D. Queen's ",Earth Sciences ,Associate Professor ,"Moser,Desmond ","BSc, Ph.D. Queen's ",Geography ,Associate Professor ,"Moser,Katrina ",BSc Queen's; MSc McMaster; B.Ed. Queen's; Ph.D. McMaster; ,Geography ,Associate Professor ,Graduate Chair "Murray,Kyle B ","BA Alberta, Ph.D. U of Alberta ",Business - Associate Dean ,Associate Professor ,"Myrvold,Wayne C ",BSc McGill; Ph.D. Boston; ,Philosophy ,Associate Professor ,"Myska,David B. ","BMUS ; MA, Ph.D. Harvard; MMUS Toronto; ",Music - Office of the Dean ,Associate Professor ,"Nagl,Tobias ",MA Indiana; Ph.D. Hamburg; ,Film Studies ,Associate Professor ,Undergraduate Chair "Naish,Michael D ","BESc, BSc, Western; MASc, UBC; Ph.D., Toronto ",Electrical & Computer/Mechanical & Materials ,Associate Professor ,"Nait-Abdallah,Areski ","LICMATH, MMATH Paris Sud; Ph.D. Paris; ",Computer Science ,Associate Professor ,"Namukasa,Immaculate Kizito ","BSc, MSc, Ph.D. Makerere, Uganda ",Education - Office of the Dean ,Associate Professor ,"Nassichuk,John ","BA Calgary; MA, Ph.D. Queen's; Ph.D. Paris VII; ",French Studies ,Associate Professor ,"Nathans,Eli ",BA Yale; BA Oxford; JD Harvard; Ph.D. Johns Hopkins; ,History ,Associate Professor ,"Navarro,Salvador ",BA ITESM Moneterrey Mexico; Ph.D. U of Chicago ,Economics ,Associate Professor ,Graduate Chair "Nelson,Andrew J ",BSc Trent; MA Sheffield; Ph.D. U of California; Faculty Scholars Award; ,Anthropology/Soc Science - Office of the Dean ,Associate Professor ,"Associate Dean (Research,Grad) ""Neufeld,Derrick James ",BComm Manitoba; CMA ; Ph.D. Western; ,Business - Associate Dean ,Associate Professor ,"Neufeld,Gerald Peter ",BMUS Manitoba; DMA Iowa; SACRED MUSIC DIP. CMBC Winnipeg; ,Music - Office of the Dean ,Associate Professor ,"Newson,Timothy A. ","BSc, Ph.D., United Kingdom ",Civil & Environmental/Engineering WindEEE ,Associate Professor ,"Nielsen,Karen M ","BA Trondheim; MA, Ph.D. Cornell ",Philosophy ,Associate Professor ,"Nolan,Catherine ","BMUS, MA McGill; MPHIL, Ph.D. Yale; ",Music - Office of the Dean ,Associate Professor ,"Associate Dean (Grad,PostDoc) ""Nousek,Debra L ",BA Alberta; MA California (Santa Barbara); Ph.D. Rutgers; ,Classical Studies ,Associate Professor ,Graduate Chair "Nowicki,Elizabeth A ","BA, BEd, MEd, Ph.D. ; ",Education - Office of the Dean ,Associate Professor ,"O'Carroll,Denis M. ","BASc, Ottawa; MS, New York; Ph.D., Michigan; P.Eng. ",Civil & Environmental ,Associate Professor ,"Obright,Katherine D ",BSc(PT) Toronto; MSc ; ,Physical Therapy ,Associate Professor ,"Okruhlik,Kathleen ","BA Marquette; MA, Ph.D. Pittsburgh; ",Philosophy ,Associate Professor ,"Olivera,Fernando ","BS ITESM; MS, Ph.D. Carnegie-Mellon; ",Business - Associate Dean ,Associate Professor ,"Olson,Kelly ","BA Calgary; MA Victoria; MA, Ph.D. Chicago; ",Classical Studies ,Associate Professor ,"Oosterveld,Valerie ",B.Soc.Sc. Ottawa; LLB Toronto; LLM Columbia; ,Womens' Studies ,Associate Professor ,"Oosterveld,Valerie ",B.Soc.Sc. Ottawa; LLB Toronto; LLM Columbia; ,Law - Office of the Dean ,Associate Professor ,"Orchard,Carole ","BSN, MEd ; EDD UBC; ",Nursing ,Associate Professor ,"Osborn,Sylvia L ",Ph.D. U of Waterloo ,Computer Science ,Associate Professor ,"Overend,Thomas J ","BPE, BSc(PT), MA, Ph.D. ; ",Physical Therapy ,Associate Professor ,School Director "Parachin,Adam ",BA Toronto; LLB Osgoode; LLM Toronto; ,Law - Office of the Dean ,Associate Professor ,"Pare,Paul-Philippe ","BS, MS Montreal; Ph.D. Pennsylvania State ",Sociology ,Associate Professor ,"Parker,Simon ",BSc. Wales; Ph.D. Durham ,Business - Associate Dean ,Associate Professor ,"Parraga,Grace Eve ",BSc MSc at Western ; Ph.D. at WASHINGTON ,Robarts - Imaging/Medical Biophysics/Oncology/Department ,Associate Professor ,"Parsa,Vijay ","BEng India; MESc, Ph.D. New Brunswick; ",Electrical & Computer ,Associate Professor ,Assistant Chair "Parsa,Vijay ","BEng India; MESc, Ph.D. New Brunswick; ",Communicative Sci & Disorders/National Centre for Audiology ,Associate Professor ,"Paul,Ileana ","BA, Ph.D. McGill; ",French Studies ,Associate Professor ,"Pazner,Micha ","BA, MA Israel; Ph.D. California; ",Geography ,Associate Professor ,"Peeters,Els ","BSc, MSc Leuven (Belgium); Ph.D. Groningen (Netherlands) ",Physics and Astronomy ,Associate Professor ,"Peng,Tianqing ",Professional Shangai Medical University China ,Department of Medicine/Pathology ,Associate Professor ,"Percival-Smith,Anthony ","Degree BC, Ph.D. Univ of Toronto ",Department of Biology ,Associate Professor ,"Perinpanayagam,Hiran ",Ph.D. at IOWA ; DDS at OTAGO ; MS at ROCHESTER ,Chemical &Biochem Engineering ,Associate Professor ,"Perinpanayagam,Hiran ",Ph.D. at IOWA ; DDS at OTAGO ; MS at ROCHESTER ,Dentistry ,Associate Professor ,"Perkin,Karen Ruth ","BS (Nursing) U of Windsor, MS (Nursing) Western ",Nursing ,Associate Professor ,"Pero,Allan ","BA, MA Ottawa; Ph.D. Toronto; ",English ,Associate Professor ,"Phu,Thy ","BA, MA, McMaster; Ph.D. UC Berkley; ",English ,Associate Professor ,"Pin,Christopher Louis ",BSc Ph.D. at Western ,Physiology and Pharmacology/Oncology/Paediatrics ,Associate Professor ,"Pitel,Stephen George Alexander ","BA Carleton; LLB Dalhousie; LLM, Ph.D. Cambridge; OF THE LAW SOCIETY OF UPPER CANADA ; ",Law - Office of the Dean ,Associate Professor ,"Pitman,Allan ","BEd, BSc Melbourne; MEd LaTrobe; Ph.D. Wisconsin (Madison); ",Education - Office of the Dean ,Associate Professor ,"Plug,Jan Patrick ","BA Ontario, Ph.D. U of Buffalo ",English ,Associate Professor ,"Poepping,Tamie Lynn ",BSc at ALBERTA ; MSc at MCMASTER ; Ph.D. at Western ,Medical Biophysics ,Associate Professor ,"Poepping,Tamie Lynn ",BSc at ALBERTA ; MSc at MCMASTER ; Ph.D. at Western ,Physics and Astronomy ,Associate Professor ,"Poire,Francois ","BA, MA, Ph.D. UQAM; ",French Studies ,Associate Professor ,"Polgar,Janice A ","BSc(OT), Ph.D. Toronto; MA Southern California; ",Occupational Therapy/Health Science - Dean's Office ,Associate Professor ,"Associate Dean (Grad,PostDoc) ""Prado,Vania ",DDS at ITA NA ; Ph.D. at MINAS GERAIS ,Anatomy & Cell Biology/Molecular Brain Research Group/Phy ,Associate Professor ,"Prakash,Anand ",BTECH IIT; Ph.D.; P.Eng. ,Chemical &Biochem Engineering ,Associate Professor ,"Premat,Adriana ","MA Victoria; MA, Ph.D. York ",Anthropology ,Associate Professor ,"Primak,Serguei ","BSc, Russia; Ph.D., Israel; P.Eng. ",Electrical & Computer ,Associate Professor ,"Purdy,Lyn ","BASC, MASc, Ph.D. Waterloo; ",Business - Associate Dean ,Associate Professor ,"Quan-Haase,Anabel ",BS Humboldt (Berlin Germany); MSc Humboldt; Ph.D. Candidate Toronto; ,Info & Media Studies - General ,Associate Professor ,"Quan-Haase,Anabel ",BS Humboldt (Berlin Germany); MSc Humboldt; Ph.D. Candidate Toronto; ,Sociology ,Associate Professor ,"Quinn,Joanna Rae ",BA Waterloo; MA Acadia; Ph.D. McMaster; ,Political Science ,Associate Professor ,"Radcliffe,Vaughan S ","BSc, MSc Manchester; Ph.D. Alberta; ",Business - Associate Dean ,Associate Professor ,"Ragogna,Paul J. ",BSc Brock; Ph.D. Dalhousie ,Chemistry ,Associate Professor ,"Rajakumar,Nagalingam ",MBBS at PERADENIYA ; MSc Ph.D. at Western ,Anatomy & Cell Biology/Psychiatry ,Associate Professor ,"Randall,Melanie ","BA ; LLB, MA Toronto; Ph.D. York; ",Law - Office of the Dean ,Associate Professor ,"Rankin,Stuart A ","Degree Saskatchewan, Ph.D. U of Ottawa ",Mathematics ,Associate Professor ,"Rao,Raveendra ","Bachelors, Ph.D. India Inst of Technology ",Electrical & Computer ,Associate Professor ,"Ray,Susan Lynn ","BScN, RegN Toronto; MScN Western; Ph.D. Alberta ",Nursing ,Associate Professor ,"Reesor,R. Mark ","BSc McGill; MMATH, Ph.D. Waterloo; ",Applied Mathematics ,Associate Professor ,"Regnault,Timothy R ",Ph.D. at COLORADO ,Physiology and Pharmacology/Obstetrics & Gynaecology ,Associate Professor ,"Reid,Graham James ",MA Ph.D. at BOWLING GRN ; BA at Western ,Paediatrics/Family Medicine ,Associate Professor ,"Reid,Graham James ",MA Ph.D. at BOWLING GRN ; BA at Western ,Psychology ,Associate Professor ,"Ren,Jiandong ","BSc, MSc Southwest Jiaotong (China); Ph.D. Temple; ",Statistics & Actuarial Science ,Associate Professor ,"Rerup,Claus ","BA, MS, Ph.D. Aarhus School of Business; ",Business - Associate Dean ,Associate Professor ,"Reyhani-Masoleh,Arash ","BSc, MSc, Tehran; Ph.D., Waterloo; ",Electrical & Computer ,Associate Professor ,"Reynard,Pierre C. ","BA, MA, Ph.D. York ",History ,Associate Professor ,"Rhoden,Nancy L ","BA, MA, Ph.D. Princeton ",History ,Associate Professor ,"Richardson,Colleen ",BMUS (Ed) Brandon; DMA Cincinnati College-Conservatory ,Music - Office of the Dean ,Associate Professor ,"Rizkalla,Amin S. ","BSc, Cario; MEng, McGill; Ph.D., Dalhousie; P.Eng. ",Chemical &Biochem Engineering ,Associate Professor ,"Rizkalla,Amin S. ","BSc, Cario; MEng, McGill; Ph.D., Dalhousie; P.Eng. ",Medical Biophysics/Dentistry ,Associate Professor ,"Robertson,Darroch A ","BA, MBA, Ph.D. Western; CMA Ontario; ",Business - Associate Dean ,Associate Professor ,"Robinson,Daniel ","BA Carleton; MA, Ph.D. York; ",Info & Media Studies - General ,Associate Professor ,"Rodenhiser,David Ivan ",BSc MSc at ACADIA ; Ph.D. at Western ,Clinical Biochemistry/Oncology/Paediatrics ,Associate Professor ,"Rodger,Susan Christine ","BA Laurier; MA, Ph.D. ; ",Education - Office of the Dean ,Associate Professor ,"Roland-Wieczorek,Sophie L. ","BMus Laurier; MA, MMus Western; DM in progress Indiana; ",Music - Office of the Dean ,Associate Professor ,Department Chair "Rothbauer,Paulette Margaret ","BA Toronto; MLIS, Ph.D. Western; ",Womens' Studies ,Associate Professor ,"Rothbauer,Paulette Margaret ","BA Toronto; MLIS, Ph.D. Western; ",Info & Media Studies - General ,Associate Professor ,"Rowe,Glenn ","BComm, MBA Memorial; Ph.D. Texas, A & M; ",Business - Associate Dean ,Associate Professor ,"Rudman,Debbie ",BSc(OT) Toronto; MSc Western; Ph.D. Toronto ,Womens' Studies ,Associate Professor ,"Rudman,Debbie ",BSc(OT) Toronto; MSc Western; Ph.D. Toronto ,Occupational Therapy ,Associate Professor ,"Rupar,Charles Anthony ",BSc Ph.D. at Western ,Paediatrics/Clinical Biochemistry ,Associate Professor ,Clinic Director/Division Chair "Rushlow,Walter James ",BSc MSc Ph.D. at Western ,Anatomy & Cell Biology/Psychiatry ,Associate Professor ,"Saad,Muhammed N ",BDS at KARACHI ,Dentistry ,Associate Professor ,Program Director "Sabarinathan,Jayshri ","BSE, MSE, Ph.D., Michigan; P.Eng. ",Electrical & Computer ,Associate Professor ,