"Sigamani,Dinesh N ","MBBS, Channai, IND; FRCA, RCCA, GBR ",Anesthesia-Perioperative Med/Schulich - Education Office ,Adjunct/MD ,"Simeunovic,Branko ",BS U of Windsor; MD Dalhousie ,Department of Medicine/Schulich - Education Office ,Adjunct/MD ,"Simon,Gary ","Professional, Dalhousie Univ ",Anesthesia-Perioperative Med ,Adjunct/MD ,"Singh,Abhay K ",FRCPCan BSc at BANARAS HINDU ; MBBS at NALANDA ,Psychiatry ,Adjunct/MD ,"Singh,Baljit ",MBBS at HYDERABAD ; BSc at JAMMU ,Obstetrics & Gynaecology/Schulich - Education Office ,Adjunct/MD ,"Singh,Minesh ",MbChB U of Natal ZAF ,Surgery/Schulich - Education Office ,Adjunct/MD ,"Singh,Rajiva Ranjan ",BS Saskatchewan ,Surgery ,Adjunct/MD ,"Sinnaeve,Linda J ",MD at Western ,Department of Medicine/Schulich - Education Office ,Adjunct/MD ,"Sisler,Jeffrey ",FCFPC MD at MANITOBA ; MClSc at Western ,Family Medicine - General ,Adjunct/MD ,"Siu,Sidney S ",Professional canada ,Department of Medicine ,Adjunct/MD ,"Smith,Gary ",MD at TORONTO ,Paediatrics ,Adjunct/MD ,"Smith,Julia A. ","Professional, Bachelors Canada ",Anesthesia-Perioperative Med/Schulich - Education Office ,Adjunct/MD ,"Smith,Pamela M ","BS, Univ St. Andrews, Scotland; MB ChB, Univ of Manchester, UK ",Pathology/Schulich - Education Office ,Adjunct/MD ,"Smith,Patrick ","BS, Univ of Windsor; MD, Univ of Toronto ",Family Medicine - General/Schulich - Education Office ,Adjunct/MD ,"Smith,Robert M ",MD Glasgow ,Department of Medical Imaging/Schulich - Education office ,Adjunct/MD ,"Snider,Stacey ",BS U of Guelph; MD McMaster Univ ,Family Medicine - General ,Adjunct/MD ,Course Coordinator "Snowdon,Bruce A. ","BSc, MD Queen's ",Surgery/Schulich - Education Office ,Adjunct/MD ,"Soderman,Mark ",FRCPCan MD at Western ,Anesthesia-Perioperative Med/Schulich - Education Office ,Adjunct/MD ,"Sondhi,Jitin ","BS, Western; MD, Univ of Toronto ",Family Medicine - General ,Adjunct/MD ,"Song,Tom Tai Young ",BSc MD at Western ,Surgery ,Adjunct/MD ,"Soong,Patrick Yen ",BSc MD at Western ,Family Medicine - General ,Adjunct/MD ,"Sorsdahl,A. Kent ","BSC, MD Saskatchewan ",Surgery/Schulich - Education Office ,Adjunct/MD ,"Sottosanti,Maria ","BS, Western; MD, Queen's Univ ",Paediatrics ,Adjunct/MD ,"Speirs,Jack ",BSc/MD UBC ,Department of Medical Imaging/Schulich - Education office ,Adjunct/MD ,"Springer,Colvin D. ","Bachelors, Professional TTO ",Oncology/Schulich - Education Office ,Adjunct/MD ,"Squires,Philip ",MD at CALGARY ,Paediatrics/Schulich - Education Office ,Adjunct/MD ,"Stapleford,Richard G ",BS DDS at Western ,Surgery/Schulich - Education Office ,Adjunct/MD ,"Stapleton,Robert ","Bs, MD U of Manitoba ",Family Medicine - General/Schulich - Education Office ,Adjunct/MD ,"Stare,Liga ",MD FRCPCan at Western ,Paediatrics/Psychiatry ,Adjunct/MD ,"State,Jonathon ","BS, Queen's Univ; MD, Univ of Toronto ",Family Medicine - General/Schulich - Education Office ,Adjunct/MD ,"Steen,Andrea R ","MD McMaster, BA Windsor ",Family Medicine - General/Schulich - Education Office ,Adjunct/MD ,"Stewart,Gregory Eric ",BS Western; MD U of Ottawa ,Family Medicine - General ,Adjunct/MD ,"Stewart,Sarah ",FRCPCan BA MD at Western ,Clinical Neurological Science ,Adjunct/MD ,"Stroker,Claire ",BS U of Kansas ,Psychiatry - Ext Camp Program ,Adjunct/MD ,"Suga Rak,Michelle Susanne ","BS, Univ of Windsor; MD, Western ",Obstetrics & Gynaecology/Schulich - Education Office ,Adjunct/MD ,"Suggitt,Terry ",BS U of Waterloo; MD U of Ottawa ,Family Medicine - General ,Adjunct/MD ,"Suke,Ralph ",BEng MEng MD at MCMASTER ,Family Medicine - General ,Adjunct/MD ,"Sullivan,David Brian ","BS, Western; MD, Royal College of Surgeons, Ireland ",Family Medicine - General ,Adjunct/MD ,"Sultan,Ghazala ",BS U of Punjab Pakistan; MD Western ,Family Medicine - General/Schulich - Education Office ,Adjunct/MD ,"Sultan,Khaleel ","MB, RCS in Ireland, IRL ",Department of Medicine ,Adjunct/MD ,"Sunderji,Salim ",FCFPC CCFP at Western ,Family Medicine - General ,Adjunct/MD ,"Suri,Rita ",FACP at ALBERTA ; MD at SASKATCHEWAN ; FRCPCan at Western ,Department of Medicine ,Adjunct/MD ,"Suryavanshi,Rajeev K ","MBBS, MS Gorakhour Univ INDIA ",Surgery/Schulich - Education Office ,Adjunct/MD ,"Suryavanshi,Shveta ",MBBS Gorakhpur Univ India ,Family Medicine - General ,Adjunct/MD ,"Sweden,Ahmed ","MB Ch.B, Al-Fateh Univ, LBY ",Department of Medicine/Schulich - Education Office ,Adjunct/MD ,"Sweet,Susan ",BSc at GUELPH ; Ph.D. at MCMASTER ; MD at OTTAWA ,Family Medicine - General/Schulich - Education Office ,Adjunct/MD ,"Sylvester,Heather Anne ","BS and MD, Western ",Family Medicine - General ,Adjunct/MD ,"Tabor,Kyle ",BA U of Waterloo; MD Queen's Univ ,Family Medicine - General ,Adjunct/MD ,"Tadros,Peter ",MD at SASKATCHEWAN ,Department of Medical Imaging/Schulich - Education office ,Adjunct/MD ,"Takahashi-Monroy,Takeshi ",MD U of Guadalajara MEXICO ,Surgery/Schulich - Education Office ,Adjunct/MD ,"Tam,Wing H. ","BA, Ph.D. Hong Kong ",Department of Medical Imaging/Schulich - Education office ,Adjunct/MD ,"Tamblyn,Charles D ",MD at Western ,Department of Medicine/Schulich - Education Office ,Adjunct/MD ,"Tan,Jerry K ",BSc MD at Queen's ,Department of Medicine/Schulich - Education Office ,Adjunct/MD ,"Tan,Richard Y ",BSc at DALHOUSIE ; MD at OTTAWA ,Department of Medicine/Schulich - Education Office ,Adjunct/MD ,"Tarhuni,Wadea M. ",Professional Libyan Arab Jamahiriya ,Department of Medicine/Schulich - Education Office ,Adjunct/MD ,"Tawil,Basel A ",MBBS Al Fateh Univ Libyan Arab Jamahiriya ,Department of Medicine/Schulich - Education Office ,Adjunct/MD ,"Tayag,Christel ",BS Univ of Torontooronto; MD Angeles Univ PHL ,Family Medicine - General/Schulich - Education Office ,Adjunct/MD ,"Taylor,John P ","MB Ch.B, Univ of Pretoria, ZAF ",Surgery ,Adjunct/MD ,"Taylor,William J ",BSc MD at OTTAWA ,Anesthesia-Perioperative Med/Schulich - Education Office ,Adjunct/MD ,"Tejpar,Shamim ",MD at PAHLAVI ,Paediatrics/Schulich - Education Office ,Adjunct/MD ,"Tetelbaum,Maria ",MD U of Medicine CA ROM ,Family Medicine - General ,Adjunct/MD ,"Thomas,Jonathan Benjamin ","MSc., Western; MD, Queen's Univ ",Family Medicine - General ,Adjunct/MD ,"Thomas,Sophia ",MD at Western ; BSc at WINDSOR ,Department of Medicine/Schulich - Education Office/Schulich ,Adjunct/MD ,Course Coordinator "Thompson,Douglas ",BSc McGill; MD Univ of Toronto ,Family Medicine - General ,Adjunct/MD ,"Thompson,Keith A ",MD Western ,Family Medicine - Primary Care ,Adjunct/MD ,"Thomsen,J Eric ",FRCSCan MD at Western ,Ophthalmology ,Adjunct/MD ,"Thomson,Alan B ","BA, MD Queen's Univ ",Department of Medicine ,Adjunct/MD ,"Thomson,Benjamin ","BSc. Hon., Univ of Waterloo; MD, Univ College Cork, IRL ",Department of Medicine ,Adjunct/MD ,"Thomson,David ",MSc MD at DALHOUSIE ; BSc at MCMASTER ,Family Medicine - General/Schulich - Education Office ,Adjunct/MD ,"Thornton,Tanya Helen ",BSc MClSc at Western ,Family Medicine - General ,Adjunct/MD ,"Thurgood,Elaine Norene ","Professional, Bachelors, BC ",Family Medicine - General ,Adjunct/MD ,"Tietze,Linda ",MD at TORONTO ; BSc at Western ,Otolaryngology/Schulich - Education Office ,Adjunct/MD ,"Toft,Ian ",BSc at Queen's ; MD at TORONTO ,Department of Medicine/Schulich - Education Office ,Adjunct/MD ,"Tomc,John E ",MD at OTTAWA ; BSc at Western ,Obstetrics & Gynaecology/Schulich - Education Office ,Adjunct/MD ,"Tomlinson,Donna Anne ","BS, MD Western ",Family Medicine - General ,Adjunct/MD ,"Toth,Darryl P ",MD at Western ,Department of Medicine/Schulich - Education Office ,Adjunct/MD ,"Toth,Michael Louis ",MD at Western ,Family Medicine - General/Schulich - Education Office ,Adjunct/MD ,"Tracey,Kevin ",BSc MD at MEMORIAL ,Department of Medical Imaging/Schulich - Education office ,Adjunct/MD ,"Tran,Quoc ",MSc Waterloo; MD Queen's ,Department of Medicine/Schulich - Education Office ,Adjunct/MD ,"Treki,Ibrahim M ",MBBCh at ALFATAH ,Department of Medicine/Schulich - Education Office ,Adjunct/MD ,"Trenker,David Charles ",MD Western ,Psychiatry ,Adjunct/MD ,"Trojanowski,Jan Adam ",BS Acadia; MD Dalhousie ,Department of Medicine ,Adjunct/MD ,"Tsui,Alice Sieh-Ying ",BSc at Queen's ; MD at Western ,Department of Medicine/Schulich - Education Office/Schulich ,Adjunct/MD ,"Tu,Geming ",MD Univ of Torontooronto ,Family Medicine - General ,Adjunct/MD ,"Tugalev,Oleg ","MD, Donetsk State Medical Univ, UKR ",Physical Medicine and Rehab ,Adjunct/MD ,"Tupper,Vashti Ellen ",BA MD CCFP at Western ,Family Medicine - General ,Adjunct/MD ,"Turkstra,Ian ","BS, Univ of Guelph; MD, Western ",Family Medicine - General ,Adjunct/MD ,"Turnbull,John R. ",MD Western ,Surgery/Surgery - Education Office ,Adjunct/MD ,"Urbantke,Elizabeth A ","BSc Western, MD Toronto ",Family Medicine - General/Department of Medicine/Schulich ,Adjunct/MD ,"Vaideswaran,Sangeeta ",MBBS Ranchi Univ INDIA ,Family Medicine - General ,Adjunct/MD ,"Vail,Gordon R ",BA MSc at Queen's ; MD at TORONTO ; CCFP at Western ,Department of Medicine/Schulich - Education Office ,Adjunct/MD ,"Van Boekel,Patricia Elisa ",BS Western; MD Memorial Univ ,Department of Medicine/Schulich - Education Office ,Adjunct/MD ,"Vandewalle,Philip Leon ",MD at Western ,Family Medicine - General ,Adjunct/MD ,"VanZyl,Cornelius J ",MBChB U of Stellenbosc ZAF; MD U of Pretoria ZAF ,Family Medicine - General ,Adjunct/MD ,"Varsava,Michael E ","BSc Queen's, MD Toronto ",Department of Medicine/Schulich - Education Office ,Adjunct/MD ,"Velehorschi,Corina ","Professional, Bachelors, ROMANIA ",Psychiatry - Ext Camp Program/Schulich - Education Office ,Adjunct/MD ,"Victory,Rahi ",,Obstetrics & Gynaecology/Schulich - Education Office/Schulic ,Adjunct/MD ,Course Coordinator "Villella,Giovanni ",MD at TORONTO ; BS at Western ,Psychiatry - Ext Camp Program/Schulich - Education Office/Sc ,Adjunct/MD ,Course Coordinator "Voegelin,Richard Edward ","Professional, Bachelors, ON ",Surgery ,Adjunct/MD ,"Vopicka,Avaleen Ann ",CCFP(EM) MD at Western ,Family Medicine - General ,Adjunct/MD ,"Vouriot,Daniel D ",MD at MANITOBA ; BSc at WINNIPEG ,Department of Medicine/Schulich - Education Office ,Adjunct/MD ,"Vreugdenhil,Michael ",MD at MCMASTER ; BSc at WATERLOO ,Family Medicine - General ,Adjunct/MD ,"Walker,Tara ",CCFP at OTTAWA ; BSc MD at UBC ,Family Medicine - General/Schulich - Education Office ,Adjunct/MD ,"Walsh,Catherine ",CCFP FCFPC BSc MD at Western ,Family Medicine - General ,Adjunct/MD ,"Wang,Angela ",BS Univ of Torontooronto; MD McMaster U ,Family Medicine - General ,Adjunct/MD ,"Warsi,Mustafa ",MBBS at KARACHI ,Psychiatry - Ext Camp Program/Schulich - Education Office ,Adjunct/MD ,"Warwaruk,Joslyn ",MD Western ,Family Medicine - General/Schulich - Education Office/Schulic ,Adjunct/MD ,"Washburn,Robert M ","BSc McGill, MD Dalhousie ",Family Medicine - General/Schulich - Education Office ,Adjunct/MD ,"Wasserman,Avi ",BA at MCGILL ; MD at TORONTO ,Department of Medicine/Schulich - Education Office ,Adjunct/MD ,"Waters,Deb ","BN Western, MD McMaster ",Family Medicine - General ,Adjunct/MD ,"Watterud,Donna ","Degree, MD Queen's U ",Family Medicine - General ,Adjunct/MD ,"Webster,Todd M ","BCOM, MD Queen's Univ ",Surgery/Schulich - Education Office ,Adjunct/MD ,"Weingert,Michael E. ","Professional, Bachelors Canada ",Department of Medicine ,Adjunct/MD ,"Westen,Evelyn ","BS, Carleton Univ ",Family Medicine - General ,Adjunct/MD ,"Wheeler,James Kevin ","BSc Honours, Western ",Family Medicine - General ,Adjunct/MD ,"Whelan,Barbara ","BSc, Univ of New Brunswick; MD, Dalhousie Univ ",Psychiatry ,Adjunct/MD ,"Whitby,Peter Lyndall ",MBChB at BIRMINGHAM ; BA (Hon) at CAMBRIDGE ; MD at Western ,Family Medicine - General ,Adjunct/MD ,"White,Frederick Albert ","BA, MD Western ",Department of Medicine ,Adjunct/MD ,"Whynot,Andrew Scott ",MD Univ of Torontooronto ,Family Medicine - General ,Adjunct/MD ,"Wiebe,Arthur George ",BSc at BROCK ; MD at OTTAWA ,Family Medicine - General/Schulich - Education Office ,Adjunct/MD ,"Wiebenga,Marjie Lynne ",MD Univ of Torontooronto ,Family Medicine - General ,Adjunct/MD ,"Wilson,Dale Robert ",BSc MD at Western ,Family Medicine - General ,Adjunct/MD ,"Wilson,Robert J. ",MD at DALHOUSIE ,Department of Medicine/Schulich - Education Office ,Adjunct/MD ,"Wilson,Tania ","BS, MD Western ",Family Medicine - General ,Adjunct/MD ,"Winger,Michael John ",FRCPCan BSc MD at MANITOBA ,Clinical Neurological Science/Schulich - Education Office ,Adjunct/MD ,"Wong,Frank G ",MD Western ,Family Medicine - General ,Adjunct/MD ,"Wong,George K ",MBBS U of Sydney Australia ,Department of Medicine/Schulich - Education Office ,Adjunct/MD ,"Woodall,Robert J ",MD at TORONTO ; BSc at WINDSOR ,Department of Medicine/Schulich - Education Office ,Adjunct/MD ,"Woolhouse,Susan Jennifer ",BS McMaster univ; MD Western ,Family Medicine - General ,Adjunct/MD ,"Yammine,Nadine Vanessa ","MD, Univ of Ottawa; MS, Western ",Otolaryngology ,Adjunct/MD ,"Yanchula,Catherine A ","BSCn, BA, Doctorate ",Schulich - Education Office/Schulich - Windsor Campus/Famil ,Adjunct/MD ,Course Coordinator "Yang,Lisa Denise ","BSc, Professional Ontario ",Family Medicine - General ,Adjunct/MD ,"Yee,John ",MD at Western ,Family Medicine - General ,Adjunct/MD ,"Yemchuk,Bohdan Roman ","Professional, Bachelor, ON ",Family Medicine - General ,Adjunct/MD ,"Yousif,Thair H ",MBChB LMCC FRCPCan ,Surgery/Schulich - Education Office ,Adjunct/MD ,"Yousuf,Junaid ","BS, Univ of Toronto; MD, Univ of Ottawa ",Oncology/Schulich - Education Office ,Adjunct/MD ,"Zaher,Amjad ",MD at DAMASCUS ,Schulich - Education Office/Paediatrics ,Adjunct/MD ,"Zakaria,Joseph ",BS McMaster Univ; MS Western ,Family Medicine - General/Schulich - Education Office ,Adjunct/MD ,"Zaki,Nasser ",MBBch AIN Shams University EGY ,Family Medicine - General/Schulich - Education Office ,Adjunct/MD ,"Zanganeh,Shahin ",MD at MCGILL ,Schulich - Education Office/Windsor Campus/Department of ,Adjunct/MD ,Course Coordinator "Zhao,Charles ",BS MD at OTTAWA ,Department of Medicine ,Adjunct/MD ,"Ziter,Dale David ",BSc MD at Western ,Family Medicine - General/Schulich - Education Office ,Adjunct/MD ,"Ziter,Paul Shiben ",BSc MD at Western ,Family Medicine - General/Schulich - Education Office ,Adjunct/MD ,"de Bruyn,John R ","BA, Ph.D. BC ",Chemistry/Applied Mathematics/Physics and ,AProfessor ,"Richardson,Bryan S ",FRCSCan MD at Western ,Paediatrics/Obstetrics & Gynaecology/Physiology and Pharm ,aProfessor/MD ,"Koka,Hanumantha R ",FRCPCan MBBS at GULBARGA ,Psychiatry - Ext Camp Program ,Assistant Prof/Clinical MD ,"Kumar,Rajender ",BSc at DELHI ; MBBS at POONA ,Psychiatry - Ext Camp Program ,Assistant Prof/Clinical MD ,"Veluri,Ramamohan ",MBBS at ANDHRA ,Psychiatry - Ext Camp Program ,Assistant Prof/Clinical MD ,"Acres,William Dixon ",BA Canada; MA/Ph.D. GBR ,History ,Assistant Professor ,"Adamus,Janusz A ","MSc Jagiellonian Poland, Ph.D. Univ of Toronto ",Mathematics ,Assistant Professor ,"Agrawal,Sumit Kishore ",BSc at NEW BRUNSWIC ; MD FRCPCan at Western ,National Centre for Audiology ,Assistant Professor ,"Al-Osman,Abdulrahman ","DDS, DIP PERIODONTICS Mantiboa; DIP. PROSTHODONTICS Damasucs, Syria; ",Dentistry ,Assistant Professor ,"Allen,Andrea Stevenson ",BA Rochester; MA Chicago; MBA York(Can); Ph.D. Wayne State; ,Womens' Studies ,Assistant Professor ,"Allman,Brian Leonard ",BS Western; Ph.D. Western ,National Centre for Audiology ,Assistant Professor ,"Allman,Brian Leonard ",BS Western; Ph.D. Western ,Anatomy & Cell Biology ,Assistant Professor ,"Amornsang,Wasan ","CERT. MAXILLOFACIAL PROSTHETICS New Orleans, Louisiana; CERT. MAXILLOFACIAL PROSTHODONTICS Pittsburh, Pennsylvania; CERT. PROSTHODONTICS MS Houston, Texas; DDS Bangkok, Thailand; MSc London; ",Dentistry ,Assistant Professor ,"Anderson,Brian ",BS U of Colorado; Ph.D. Indiana Univ ,Business - Associate Dean ,Assistant Professor ,"Ansari,Emily Theodosia Abrams ","BA Durham Univ UK, MA Oxford Univ UK ",Music - Office of the Dean ,Assistant Professor ,"Anthony,Susan Elizabeth ","BScN, MScN, RegN ; ",Nursing ,Assistant Professor ,"Archibald,Lisa M.D. ",BSc Brock; M.H.Sc Toronto; Ph.D. Durham UK ,Communicative Sci & Disorders ,Assistant Professor ,"Archibald,Lisa M.D. ",BSc Brock; M.H.Sc Toronto; Ph.D. Durham UK ,Psychology ,Assistant Professor ,"Argall,Philip S ","BSC, Ph.D. Adelaide, AUS ",Physics and Astronomy ,Assistant Professor ,"Argentino,Joe R. ","Bmus, Univ of Toronto; Ph.D. Western ",Music - Research & Composition ,Assistant Professor ,"Ari,Timucin ","DDS, Ph.D. Marmara U Turkey ",Dentistry ,Assistant Professor ,"Arku,Godwin ","BA Ghana, MA Univ of Toronto, Ph.D. McMaster ",Geography ,Assistant Professor ,"Arntfield,Michael Andrew ","BA, Western; BA (Honors), Western; MA, Western; Ph.D., Western ",Arts - Writing ,Assistant Professor ,"Arntfield,Michael Andrew ","BA, Western; BA (Honors), Western; MA, Western; Ph.D., Western ",Info & Media Studies - General ,Assistant Professor ,"Arntfield,Michael Andrew ","BA, Western; BA (Honors), Western; MA, Western; Ph.D., Western ",Centre for American Studies ,Assistant Professor ,"Arriaga,Eduard Alberto ","MA, Instituto Caro y Cuervo; Ph.D. Western; ",Modern Languages & Literatures ,Assistant Professor ,"Aryee,Abednego ",BA GHA; Ph.D. Wilfrid Laurier ,Geography ,Assistant Professor ,"Asantey,Solomon Ben Akotua ","BSc., Univ of Sci & Tech, Ghana; M.Phil. Univ of Sci & Tech, Ghana; Ph.D., Western; ",Civil & Environmental ,Assistant Professor ,"Aylen,Marielle ",BFA Ottawa; Ph.D. York ,Arts - Writing/Visual Arts ,Assistant Professor ,"Babanski,Alexander ",BFA Ottawa; Ph.D. York ,Computer Science ,Assistant Professor ,"Babcock,Mark Anthony ","BSc., Univ of Guelph; MHK, Univ of Windsor; Ph.D., Western ",School of Health Studies ,Assistant Professor ,"Babenko-Mould,Yolanda Brenda ","BA, MSc (Nursing), Professional Designation Western ",Nursing ,Assistant Professor ,"Bacard,Hugo ",BS U of Guelph; Ph.D. Western ,Mathematics ,Assistant Professor ,"Bajura,Steven Wally ","BSc Honors, Wester; MSc., Western; DDS, Western ",Dentistry ,Assistant Professor ,"Bakan,Jonathon ","BFA, MA, Ph.D. York ",Music - Research & Composition ,Assistant Professor ,"Ball,Jill M. ",BMUS Central Michigan; DMA Michigan State; MM Northwestern; ,Music - Office of the Dean ,Assistant Professor ,"Banks,Michelle Dawn ","BA, Dalhousie Univ; MA, Dalhousie Univ; Ph.D. Western ",Film Studies ,Assistant Professor ,"Bannerjee,Rohini Reena ","BSc, MA Dalhousie NS; Ph.D. Western ",French Studies ,Assistant Professor ,"Barghi,Shahzad ","BSc, MSc Iran; Ph.D. London; P. Eng. ",Chemical &Biochem Engineering ,Assistant Professor ,"Barker,Gillian ","BA Toronto, Ph.D. California ",Philosophy ,Assistant Professor ,"Barmby,Pauline M ","BS UBC, Ph.D. Harvard ",Physics and Astronomy ,Assistant Professor ,"Barr,Stephen ",BSc Ph.D. at CALGARY ,Microbiology & Immunology ,Assistant Professor ,"Barteet,Charles Cody ",BA Charleston; MA Texas at San Antonio; Ph.D. SUNY Binghamton ,Visual Arts ,Assistant Professor ,"Barth,Aaron Mitchell ",BA Queen's U; Ph.D. Western ,Philosophy ,Assistant Professor ,"Barysevich,Alena ","BA, Minsk Linguistic Univ; MA, Western; Ph.D. Western ",Modern Languages & Literatures/French Studies ,Assistant Professor ,"Bassnett,Madeline ",BA Univ of Torontooronto; Ph.D. Dalhousie Univ ,English/Womens' Studies ,Assistant Professor ,"Bates,Peter ","HBA and MA, Western ",Education - Graduate Education ,Assistant Professor ,"Begen,Mehmet ","BS Turkey, MS UBC ",Business - Associate Dean ,Assistant Professor ,"Begen,Mehmet ","BS Turkey, MS UBC ",Epidemiology and Biostatistics ,Assistant Professor ,"Belfry,Glen Robert ","BA, MA ; BA Ottawa; BEd Queen's; ",Kinesiology - General ,Assistant Professor ,"Bello,Juan ",BA U of Calolica Venezuels; Mart Internac de Andalucia Spain ,Film Studies ,Assistant Professor ,"Bendle,Neil ",BA U of Nottingham GBR; MBA U of Virginia ,Business - Associate Dean ,Assistant Professor ,"Berest,Julia ","BA Ukraine; MA, Central European Univ; Ph.D. Western ",History ,Assistant Professor ,"Biggs,Terrence Charles ","BA, Ph.D. Ontario ",Psychology ,Assistant Professor ,"Billou,Niels ","HBA, MBA, Western ",Business - Associate Dean ,Assistant Professor ,"Binns,Andrew ","BS, Ph.D. Queen's Univ ",Civil & Environmental ,Assistant Professor ,"Blankenship,Janelle S ",BA Truman; MA Texas; Ph.D. Duke ,Film Studies ,Assistant Professor ,"Boisvert,Michael James ","Bachelors, Masters Ontario ",Psychology ,Assistant Professor ,"Borradaile,Nica Maria ","BSc, Ph.D. Western ",Physiology and Pharmacology ,Assistant Professor ,"Bourdage,Joshua ","BA, MS U of Calgary ",Psychology ,Assistant Professor ,"Bourget,David ","BS, Ph.D. Univ of Torontooronto ",Philosophy ,Assistant Professor ,"Bousfield,Dan ","BA York, Ph.D. McMaster ",Political Science ,Assistant Professor ,"Bronaugh,Richard N ","BA Oregon; BLITT Oxon; MS, Ph.D. Wisconsin; ",Law - Office of the Dean ,Assistant Professor ,"Brou,Daniel ",MA Toronto; MPhil Columbia ,Bachelor of Mgmt & Org Studies ,Assistant Professor ,"Brown,Jason Charles Leslie ",MSc Western; Ph.D. Western ,Department of Biology ,Assistant Professor ,"Brown,Patrick ","BA Ontario, Ph.D. U of Waterloo ",Psychology ,Assistant Professor ,"Bruce,Barbara Susanne ","Bachelors, Masters, DART Ontario ",Film Studies ,Assistant Professor ,"Brunt,Shawn ",BSc at GUELPH ; DDS at TORONTO ,Dentistry ,Assistant Professor ,"Buchel,Olga ",BSc at GUELPH ; DDS at TORONTO ,Info & Media Studies - General ,Assistant Professor ,"Buj,Lorenzo ",BA Ontario; Ph.D. Michigan ,Visual Arts ,Assistant Professor ,"Bullen,Ross Daniel ","MS Sofia Univ, Ph.D. Bulgaria ",English ,Assistant Professor ,"Buma,Michael Paul ",BA Calvin College USA; Ph.D. Western ,English ,Assistant Professor ,"Bunch,Mary Jennifer ",BA York Univ; MART Western ,Womens' Studies ,Assistant Professor ,"Bureau,Yves ","BA Ontario, Ph.D. Carleton Univ ",Psychology ,Assistant Professor ,"Burke,Shauna Marie ","BA KIN McMaster; MA KIN, Ph.D. KIN Western; ",School of Health Studies ,Assistant Professor ,"Burucua,Constanza ",BA U de Buenosaires ARG; Ph.D. U of Warwick GBR ,Film Studies ,Assistant Professor ,"Butler,Michael John ","BSc, Ph.D. ",Department of Biology ,Assistant Professor ,"Byrd Clark,Julie S ","BA U of New York, Ph.D. Univ of Toronto ",Education - Office of the Dean ,Assistant Professor ,"Cami,Jan ","BSc, MSc Leuven (Belgium); Ph.D. Amsterdam ",Physics and Astronomy ,Assistant Professor ,"Campbell,John Donald ",BA York Univ; MART Western ,Psychology ,Assistant Professor ,"Campbell,Karen Edith ","BA U of Windsor, MSc Univ of Toronto ",Physical Therapy/Nursing ,Assistant Professor ,"Cann,Adam Paul ",BS Laurentian Univ; Ph.D. Western ,School of Health Studies/Physical Therapy ,Assistant Professor ,"Capitan,Radu-Dan ",BA Western; LLB Ottawa ,Geography ,Assistant Professor ,"Caracchini,Cristina ",MART Univ Firenze Italy; Ph.D. Montreal ,Modern Languages & Literatures ,Assistant Professor ,"Cardy,Janis ","BA, MSc McGill; Ph.D. Toronto ",Communicative Sci & Disorders/National Centre for Audiology ,Assistant Professor ,"Carleton,Sarah Mayumi ","BMUS, Ph.D. Univ of Toronto ",Music - Performance Studies ,Assistant Professor ,"Carrilho,Marcela ","DDS, Ph.D. U of Sao Paulo BRA ",Dentistry ,Assistant Professor ,"Carson,Jeffrey John Leslie ",Ph.D. Western ,Medical Biophysics ,Assistant Professor ,"Carter,Matthew ","AB Harvard; M.St, Ph.D. Oxford ",Classical Studies ,Assistant Professor ,"Ceraldi,Gabrielle Kristina ","BA Queen's, MA Manitoba, Ph.D. Western ",English ,Assistant Professor ,"Chebaro-Burrafato,Lara ","Bachelors, Masters Ontario ",Education - Continuing Educ ,Assistant Professor ,"Chen,Jeff Z. ","BA China, Doctorate NY USA ",Medical Biophysics/Oncology ,Assistant Professor ,"Chesworth,Herbert M ","BA, BSc(PT), MSc(PT), Ph.D.; ",Epidemiology and Biostatistics ,Assistant Professor ,"Choi,Hee Young ","BA, Duke Univ; Ph.D., Univ of California ",Sociology ,Assistant Professor ,"Choi,Yun-Hee ",BSc at SOOKMYUNG ; Ph.D. at WATERLOO ; MA at YORK ,Epidemiology and Biostatistics ,Assistant Professor ,"Chouinard,Philippe ","BS, Ph.D. McGill Univ QC ",Psychology ,Assistant Professor ,"Chovaz,Cathy Jean ",BSc Ph.D. MSc at Western ,Psychiatry ,Assistant Professor ,"Chow,Ivan W. ","BA, MA, Ph.D. Univ of Toronto ",French Studies ,Assistant Professor ,"Chow,Sheldon ","BA, MA, Ph.D. Univ of Toronto ",Philosophy ,Assistant Professor ,"Chung,Kenneth Kin Hung ","BA McGill, MART Saskatchewan; Ph.D. Western ",Philosophy ,Assistant Professor ,"Clapton,Mysty Sybil ","BA Hons Western; LLB Western, LLM Cambridge; ",Law - Office of the Dean ,Assistant Professor ,"Clendinning,Sherri Lee ",BA/MA/Ph.D. Ontario ,French Studies ,Assistant Professor ,"Coatsworth-Puspoky,Robin Deborah ","BA, MA Ontario ",Nursing ,Assistant Professor ,"Cobb,Graham ","BS, DDS Dalhousie Univ NS ",Dentistry ,Assistant Professor ,"Cobban,Tim William ","BA, Ph.D. Western; ",Political Science ,Assistant Professor ,"Cociuba,Simona ",BA Univ de Vest Timisoara Romania; Ph.D. U of Minnesota USA ,Economics ,Assistant Professor ,"Cohen,Adam ",BA Rutgers Univ USA; Ph.D. U of Calif Santa Barbara USA ,Psychology ,Assistant Professor ,"Colquhoun,Ian C ","BA Western; MA McMaster; Ph.D. Washington University, St. Louis USA ",Anthropology ,Assistant Professor ,"Combariza Gonzalez,German Andres ","Mmath, Universidad de los Andes; Ph.D. Western ",Mathematics ,Assistant Professor ,"Corrigall-Brown,Catherine Joanna ",BA Canada; Ph.D. U of California USA ,Sociology ,Assistant Professor ,"Cramp,Anita ",BA Wilfrid Laurier; Ph.D. McMaster Univ ,School of Health Studies ,Assistant Professor ,"Cristancho,Sayra M ",BS Univ Pontificia COL; Ph.D. UBC ,Medical Biophysics/Surgery ,Assistant Professor ,"Crooks,Claire ","BA USA, Ph.D. Ontario ",Education - Preservice Office ,Assistant Professor ,