"Chan,Francis P ",BSc Ph.D. at Western ,Anatomy & Cell Biology ,Professor ,"Charland,Louis C ",BA MA at CARLETON ; Ph.D. at Western ,Philosophy ,Professor ,"Charland,Louis C ",BA MA at CARLETON ; Ph.D. at Western ,School of Health Studies ,Professor ,"Charland,Louis C ",BA MA at CARLETON ; Ph.D. at Western ,Psychiatry ,Professor ,"Charpentier,Paul A ",HBSC York; MSc Waterloo; Ph.D. McMaster; ,Chemical &Biochem Engineering ,Professor ,"Christensen,J.Daniel ",BMATH Waterloo; Ph.D. M.I.T.; ,Mathematics/Applied Mathematics ,Professor ,Graduate Chair "Ciriello,John ",BA MSc Ph.D. at Western ,Physiology and Pharmacology ,Professor ,"Clark,Samuel ",BA Carleton; MA Toronto; Ph.D. Harvard; ,Sociology ,Professor ,"Coates,Paul ",BA Cambridge; MA Sussex; Ph.D. Warsaw ,Film Studies ,Professor ,Graduate Chair "Comor,Edward ",BA Toronto; MA Leeds; Ph.D. York; ,Info & Media Studies - General ,Professor ,"Compeau,Deborah R. ","HBA, Ph.D. Western; ",Business - Associate Dean ,Professor ,"Conklin,David W ",BA Toronto; Ph.D. MIT; ,Business - Associate Dean ,Professor ,"Connidis,Ingrid A ","BA, MA ; Ph.D. Toronto; ",Sociology ,Professor ,"Conway,Alison ",BA British Columbia; MA York; Ph.D. California (Berkeley); THE Western AWARD FOR EXCELLENCE IN TEACHING (1999) ; ,English ,Professor ,"Corless,Robert M ","BSc, Ph.D. UBC; MMATH Waterloo; Western Distinguished Professor ",Applied Mathematics ,Professor ,"Corrigan,John F ",BSc Toronto; Ph.D. Waterloo; ,Chemistry ,Professor ,Centre Director "Cote,James E ",BA Trent; MA ; Ph.D. York; ,Sociology ,Professor ,"Cottam,Michael G ","BA, MA Cambridge; DPHIL Oxford; ",Physics and Astronomy ,Professor ,"Coulter,Rebecca ","BA, MEd, Ph.D. Alberta ",Education - Office of the Dean ,Professor ,"Creed,Irena F. ","BSc, MSc Toronto; ",Department of Biology ,Professor ,"Creed,Irena F. ","BSc, MSc Toronto; ",Geography ,Professor ,"Crossan,Mary Margaret ","BA, MBA, Ph.D. Western; ",Business - Associate Dean ,Professor ,"Cunningham,Ian A. ",MSc at MCMASTER ; BSc at Queen's ; Ph.D. at TORONTO ,Medical Biophysics/Robarts - Imaging/Department of Medica ,Professor ,"Dagnino,Lina ",Ph.D. at ALBERTA ; BSc at MEXICO ,Physiology and Pharmacology ,Professor ,Graduate Chair "Daley,Thomas D ",FRCDC DDS at TORONTO ; MSc at Western ,Dentistry/Pathology ,Professor ,"Darnell,Regna ","BA Bryn Mawr College USA, MA, Ph.D. U of Pennsylvania ",Pathology ,Professor ,"Darnell,Regna ","BA Bryn Mawr College USA, MA, Ph.D. U of Pennsylvania ",Anthropology ,Professor ,"Davies,James B ","BA Manitoba; MSc, Ph.D. London; EPRI Executive Director ",Economics ,Professor ,"Davison,Matt ","BASC Toronto; MSc, Ph.D. ; ",Business - Associate Dean ,Professor ,"Davison,Matt ","BASC Toronto; MSc, Ph.D. ; ",Statistics & Actuarial Science/Applied Mathem ,Professor ,"Dawar,Niraj ","BComm, MBA India; Ph.D. Penn State; ",Business - Associate Dean ,Professor ,"de Bruyn,John R ","BA, Ph.D. BC ",Mechanical & Materials ,Professor ,"De Lasa,Hugo I ","CHEMICAL ENGINEER Universidad National del Sur (Argentina); DIPLOME D'ETUDES APPROFONDIES, DOCTEUR-ING, NIEUR Nancy; ING; P. Eng. ",Chemical &Biochem Engineering ,Professor ,"de Looze,Laurence ","BA, MA Oregon; MA, Ph.D. Toronto; ",Modern Languages & Literatures ,Professor ,"Dean,Charmaine ",BS U of Saskatchewan; Ph.D. U of Waterloo ,Science - Office of the Dean ,Professor ,Dean "Dekaban,Gregory A. ",BSc at Queen's ; Ph.D. at Western ,Microbiology & Immunology/Robarts - Biotherapeutics ,Professor ,"Dhanda,Amita ","BA and Ph.D., Univ of Delhi, IND ",Law - Office of the Dean ,Professor ,"Dickinson,Gregory Millyard ","BA, LLB, OF THE BAR OF ONTARIO ; EDD Toronto; ",Education - Office of the Dean ,Professor ,"Disalle,Robert J ","BA Georgetown; MA, Ph.D. Chicago; ",Philosophy ,Professor ,"Dixon,S Jeffrey ",FRCDC BSc at CARLETON ; Ph.D. at TORONTO ; MSc DDS at Western ,Dentistry/Physiology and Pharmacology ,Professor ,"Doherty,Alison J ","BA ; MPE, Ph.D. Ottawa; ",Kinesiology - General ,Professor ,"Donner,Allan ",Ph.D. at HARVARD ; BSc MSc at MANITOBA ,Epidemiology and Biostatistics/Robarts Clinical Trials ,Professor ,"Doyle,Philip ","BA, MA, Ph.D. California; ",Communicative Sci & Disorders ,Professor ,"Doyle,Philip ","BA, MA, Ph.D. California; ",Otolaryngology ,Professor ,"Dozois,David ",BA MS Ph.D. at CALGARY ,Psychiatry ,Professor ,"Dozois,David ",BA MS Ph.D. at CALGARY ,Psychology ,Professor ,"Dryden,John R ","BASC, Ph.D. Windsor; PEng ; ",Mechanical & Materials ,Professor ,"Dunn,Stanley D ",BS at NEBRASKA ; Ph.D. at UCAL-BERK ,Biochemistry ,Professor ,"El Damatty,Ashraf ","BSc, MSc Cairo; Ph.D. McMaster; P. Eng. ",Civil & Environmental/Engineering WindEEE ,Professor ,Department Chair "El Naggar,Hesham M ","BSc, MSc Alexandria; Ph.D.; P.Eng. ",Engineering Research/Grad Srvc ,Professor ,"Associate Dean (Research,Grad) ""Elliott,Bridget J ",BA Toronto; MA UBC; Ph.D. London; ,Visual Arts ,Professor ,"Ellis,Christopher Gerald ",BEng at MCMASTER ; Ph.D. at NORTHWESTERN ,Department of Medicine/Medical Biophysics ,Professor ,"Ellis,Christopher J ",BA Waterloo; MA McMaster; Ph.D. Simon Fraser; ,Anthropology ,Professor ,Department Chair "Emberley,Julia Vivienne Charlotte ",BA Western; MA Queen's; Ph.D. York; ,English ,Professor ,"Esses,Victoria M ","BSc ; MA, Ph.D. Toronto; ",Psychology/Migration & Ethnic Relations ,Professor ,"Essex,Chris ",BSc ; MS Rice; Ph.D. York(Can); ,Applied Mathematics ,Professor ,"Everling,Stefan ",BSc MSc BSc Ph.D. at BREMEN ,Psychiatry/Robarts - Imaging/Physiology and Pharmacology ,Professor ,"Everling,Stefan ",BSc MSc BSc Ph.D. at BREMEN ,Psychology ,Professor ,"Falkenstein,Lorne ","BA Regina; MA, Ph.D. Toronto; ",Philosophy ,Professor ,"Falkowska,Janina ",MA Poznan; Ph.D. McGill; ,Film Studies ,Professor ,"Feldman,Ross D ",FRCPCan BSc MD at Queen's ,Physiology and Pharmacology/Department of Medicine/Roba ,Professor ,"Feng,Qingping ",Ph.D. at GOTHENBURG ; MD at NANJING ,Department of Medicine/Physiology and Pharmacology ,Professor ,"Figlewicz,Denise ","BS, Ph.D. Loyola Univ Chicago USA ",Schulich - Office of the Dean ,Professor ,Vice Dean "Fisher,William ","BA Tel Aviv; MS, Ph.D. Purdue; THE UNIVERSITY OF WESTERN ONTARIO EXCELLENCE IN TEACHING AWARD (1989) ; Western Distinguished Professor ",Obstetrics & Gynaecology ,Professor ,"Fisher,William ","BA Tel Aviv; MS, Ph.D. Purdue; THE UNIVERSITY OF WESTERN ONTARIO EXCELLENCE IN TEACHING AWARD (1989) ; Western Distinguished Professor ",Psychology ,Professor ,"Floryan,Jerzy M ",MSc Warsaw; PEng ; Ph.D. Virginia; ,Mechanical & Materials ,Professor ,Department Chair "Floryan,Jerzy M ",MSc Warsaw; PEng ; Ph.D. Virginia; ,Applied Mathematics ,Professor ,"Foerster,Stephen R ",BA Western; CFA; MA; Ph.D. Pennsylvania ,Business - Associate Dean ,Professor ,"Forchuk,Cheryl ","BA, BScN Windsor; MScN Toronto; Ph.D. Wayne State; RegN ; ",Nursing ,Professor ,"Forchuk,Cheryl ","BA, BScN Windsor; MScN Toronto; Ph.D. Wayne State; RegN ; ",Psychiatry ,Professor ,"Ford-Gilboe,Marilyn ","BScN, RegN ; MScN Toronto; Ph.D. Wayne State; ",Nursing ,Professor ,"Ford-Gilboe,Marilyn ","BScN, RegN ; MScN Toronto; Ph.D. Wayne State; ",Family Medicine - General ,Professor ,"Friel,Raymond ",BOTH Univ College IRL ,Law - Office of the Dean ,Professor ,"Gandz,Jeffrey ","MBA, Ph.D. York(Can); ",Business - Associate Dean ,Professor ,"Gardiner,Michael ","BA, MA Calgary; Ph.D. York; ",Sociology ,Professor ,"Gawronski,Bertram ","MA Germany, Ph.D. Humboldt U Germany ",Psychology ,Professor ,"Ghenniwa,Hamada H ","BSc Al-Fateh (Libya); MSc, Ph.D. Waterloo; ",Electrical & Computer ,Professor ,"Gloor,Gregory B ",BSc Ph.D. at Western ,Biochemistry ,Professor ,"Goffin,Richard D ",BA Brock; MA Guelph; Ph.D. ; ,Psychology ,Professor ,"Goldberg,Harvey A ",Ph.D. at ALBERTA ; MPhil at LONDON ; BSc at MCGILL ,Dentistry/Biochemistry ,Professor ,"Goldenberg,Dolly ","BScN, MScN ; Ph.D. Wayne State; ",Nursing ,Professor ,"Goldschlager,Alain ",LE_SL Agre_g Brussels; Ph.D. Toronto; ,French Studies ,Professor ,"Goodale,Mel A ",BA at ALBERTA ; MA at CALGARY ; Ph.D. at Western ,Psychology ,Professor ,"Graves,Brian ",BA McGill Univ; LLB Univ of Toronto ,Law - Office of the Dean ,Professor ,"Green,Milford B ","BA, MA, Ph.D. Ohio State; ",Geography ,Professor ,"Gribble,Paul ",BSc Ph.D. ,Physiology and Pharmacology ,Professor ,"Gribble,Paul ",BSc Ph.D. ,Psychology ,Professor ,"Grier,James N ","BA, MA, MUSBAC, Ph.D. Toronto; ",Music - Office of the Dean ,Professor ,"Grinlinton,David ",BA Massey Univ NZL; LLM U of Western Australia AUS ,Law - Office of the Dean ,Professor ,"Groden,Michael ","BA Dartmouth College; MA, Ph.D. Princeton; ",English ,Professor ,"Groves,Matthew ","BA, Ph.D. Monash Univ AUS ",Law - Office of the Dean ,Professor ,"Hall,Craig R ","BA, BPE McMaster; MPE Windsor; Ph.D. Alberta; ",Kinesiology - General ,Professor ,"Hampson,Elizabeth ",BA at SASKATCHEWAN ; MA Ph.D. at Western ,Psychiatry ,Professor ,"Hampson,Elizabeth ",BA at SASKATCHEWAN ; MA Ph.D. at Western ,Psychology ,Professor ,"Han,Victor K ",FRCPCan FRCP MBBS at BURMA INST ,Biochemistry/Obstetrics & Gynaecology/Paediatrics ,Professor ,"Hangan,Horia Mihai ","BSc Romania; MSc, Ph.D., P.Eng. ",Civil & Environmental/Engineering WindEEE ,Professor ,Research Director "Haniford,David B ",Ph.D. at TORONTO ; BSc at Western ,Biochemistry ,Professor ,"Harris,Roma Maria ","BA UBC; MA, MPA, Ph.D. Western; ",Info & Media Studies - General ,Professor ,"Heinrichs,David E ",BSc at MANITOBA ; Ph.D. at Queen's ,Microbiology & Immunology ,Professor ,"Herbert,Carol P ","BA British Columbia, Professional U of BC ",Family Medicine/Pathology ,Professor ,"Hicock,Stephen R ","BSc, MSc British Columbia; Ph.D.; Faculty of Science Teaching Award (1999), Edward G. Pleva Award for Excellence in Teaching(2002), OCUFA Teaching Award (2004); ",Earth Sciences ,Professor ,"Higgins,Chris ","BMATH, MMATH, Ph.D. Waterloo; ",Business - Associate Dean ,Professor ,"Hill,David J ",BSc at NOTTINGHAM ; DPhil at OXFORD ,Physiology and Pharmacology/Department of Medicine ,Professor ,"Hocking,Wayne K ",Ph.D. U of Adelaide Australia ,Physics and Astronomy ,Professor ,"Hoffman,Jay ","Bachelors, Ph.D. Canada ",Law - Office of the Dean ,Professor ,"Hoffmaster,Barry C ",AB Dartmouth; MA; Ph.D. Minnesota; ,Philosophy ,Professor ,"Holdsworth,David W. ",BSc MSc Ph.D. at TORONTO ,Medical Biophysics/Robarts - Imaging/Department of Medica ,Professor ,"Holt,Richard A ",Ph.D. Harvard USA ,Physics and Astronomy ,Professor ,"Hong,Han-Ping ","BEng, DRENG, MEng, Mexico; P.Eng. ",Civil & Environmental/Engineering WindEEE ,Professor ,"Houghton,Pamela Elizabeth ","BSc, BSc(PT), Ph.D. ; ",Physical Therapy ,Professor ,"Hovius,Berend ","BA Queen's; DIPED, LLB, OF THE LAW SOCIETY OF UPPER CANADA ; LLM London; ",Law - Office of the Dean ,Professor ,"Howell,Jane Mary ","BA, Ph.D. British Columbia; MA Western; ",Business - Associate Dean ,Professor ,"Hrymak,Andrew N ","BEng, Chemical Engineering, McMaster; PEng, FCIC, Ph.D. Chemical Engineering, Carnegie Mellon University. ",Engineering - Office of Dean/Mechanical & Materials ,Professor ,Dean "Huang,Yining ",Ph.D. McGill ,Chemistry ,Professor ,"Hudson,Robert ",Doctorate Univ of Torontooronto ,Biochemistry ,Professor ,"Hudson,Robert ",Doctorate Univ of Torontooronto ,Chemistry ,Professor ,"Huff,Murray W ",BSc at MCMASTER ; Ph.D. at Western ,Biochemistry/Robarts - Vascular Biology/Department of Medi ,Professor ,"Huner,Norman P A ","BSc, MSc; Ph.D. Carleton; DSC(H) Umea (Sweden); FRSC; ",Department of Biology ,Professor ,"Hunter,Graeme K ",BSc Ph.D. at GLASGOW ,Dentistry /Biochemistry ,Professor ,Division Chair "Hunter,Graeme K ",BSc Ph.D. at GLASGOW ,Chemistry ,Professor ,"Huscroft,Grant Ainsley ",BA Western; LLB Queen's; LLM Auckland; ,Law - Office of the Dean ,Professor ,"Hynes,Jason Barry ",BS Univ of Waterloo; LLB Western ,Law - Office of the Dean ,Professor ,"Ilie,Lucian ","BSc, MSc Bucharest; Ph.D. Turku, Finland; ",Computer Science ,Professor ,"Isaacs,Tracy L ","BA, MA Toronto; Ph.D. MIT; ",Philosophy/Womens' Studies ,Professor ,"Iwasiw,Carroll Louise ","BN Manitoba; EdD Toronto; MScN, RegN ; ",Nursing ,Professor ,"Jaffe,Peter G ",BSc at MCGILL ; MA Ph.D. at Western ,Education - Office of the Dean/Centre-RES&EdViol-AWom&Child ,Professor ,"Jardine,John F ",Ph.D. U of BC ,Mathematics ,Professor ,"Jeffrey,David ",Ph.D. Cambridge Univ UK ,Mechanical & Materials ,Professor ,"Jeffrey,David ",Ph.D. Cambridge Univ UK ,Applied Mathematics/Science - Office of the D ,Professor ,Department Chair "Jiang,Jin ","BESc Xi'an Jiaotong; MESc, Ph.D. New Brunswick; P.Eng. ",Electrical & Computer ,Professor ,"Jin,Jisuo ","BA China, Ph.D. U of Saskatchewan ",Earth Sciences ,Professor ,"Johnson,Fraser P ","HBA, MBA, Ph.D. Western; ",Business - Associate Dean ,Professor ,"Johnson,James A ",BEng McGill; BSc Concordia; Ph.D. TUNS; P.Eng. ,Mechanical & Materials/Biomed Eng Interdis Grad Prog ,Professor ,"Johnson,James A ",BEng McGill; BSc Concordia; Ph.D. TUNS; P.Eng. ,Medical Biophysics/Surgery ,Professor ,"Jones,Bruce Leonard ","BA Ontario, Ph.D. U of Waterloo ",Statistics & Actuarial Science ,Professor ,Department Chair "Jones,Bruce Leonard ","BA Ontario, Ph.D. U of Waterloo ",Sociology ,Professor ,"Jones,Douglas L ",BSc MSc at ALBERTA ; Ph.D. at CALGARY ,Physiology and Pharmacology ,Professor ,"Jones,Manina ","BA, MA Western; Ph.D. York; ",English ,Professor ,"Karamanev,Dimitre G ",BSc Russia; Ph.D. Bulgaria; P.Eng. ,Chemical &Biochem Engineering ,Professor ,"Kari,Lila ",MSc at BUCURESTI ; Ph.D. at TURKU ,Biochemistry ,Professor ,"Kari,Lila ",MSc at BUCURESTI ; Ph.D. at TURKU ,Computer Science ,Professor ,"Karky,Ramesh Bikram ",Ph.D. USA ,Law - Office of the Dean ,Professor ,"Karmazyn,Morris ",BSc at CONCORDIA ; MSc Ph.D. at MCGILL ,Physiology and Pharmacology ,Professor ,"Katz,Albert N ","BSc McGill; MA, Ph.D. ",Psychology ,Professor ,Department Chair "Kavaliers,Martin I ","BSc, MSc Sir George Williams; Ph.D. Alberta; ",Psychology ,Professor ,"Kelly,Gregory M ",Ph.D. U of Manitoba ,Department of Biology ,Professor ,"Kerr,Michael A. ",BSc Waterloo; Ph.D. Hawaii; ,Chemistry ,Professor ,"Khalkhali,Masoud ",BSc Sharif(Tehran); Ph.D. Dalhousie; ,Mathematics ,Professor ,"Khayat,Roger E ","BA Quebec, Ph.D. McGill ",Mechanical & Materials ,Professor ,"Khayat,Roger E ","BA Quebec, Ph.D. McGill ",Applied Mathematics ,Professor ,"Kidnie,Margaret Jane ","BA Toronto; MA, Ph.D. The Shakespeare Institute; ",English ,Professor ,"Kim,Richard B ",Bachelors Saskatchewan; Professional Ontario ,Physiology and Pharmacology/Oncology/Department of Med ,Professor ,"King,Graham J ",FRCSCan MSc at CALGARY ; BSc MD at UBC ,Medical Biophysics/Surgery ,Professor ,"Klassen,Robert David ",BA Waterloo; MBA Western; Ph.D. N. Carolina; ,Business - Associate Dean ,Professor ,"Klassen,Robert David ",BA Waterloo; MBA Western; Ph.D. N. Carolina; ,Program in Environmental Sci ,Professor ,"Knight,John ","BComm, MComm, Ph.D. New South Wales; ",Economics ,Professor ,"Knoll,Joan Helen Mary ","BS, Ph.D., Western ",Pathology ,Professor ,"Knopf,George K ","BA, BEng, MSc, Ph.D. Saskatchewan; P.Eng. ",Mechanical & Materials ,Professor ,"Kogon,Stanley L ",DDS Toronto; MSc ,Dentistry ,Professor ,"Kolkman,Wilbert ","MLS, Ph.D. Univ of Groningen, NLD ",Law - Office of the Dean ,Professor ,"Konermann,Lars ","BSc, MSc Tubingen; Ph.D. Dusseldorf; ",Biochemistry ,Professor ,"Konermann,Lars ","BSc, MSc Tubingen; Ph.D. Dusseldorf; ",Chemistry ,Professor ,"Konrad,Alison M ","BA Monmouth College; MA, Ph.D. Claremont Graduate School; ",Business - Associate Dean ,Professor ,"Kopp,Gregory A ",BSc Manitoba; MSc McMaster; Ph.D. Toronto; P.Eng. ,Civil & Environmental ,Professor ,"Koprowski,Peter ","ARTIST'S DIPLOMA State Academy of Music, Lodz; DMUS Toronto; MA Krakow; ",Music - Office of the Dean ,Professor ,"Koropatnick,D James ",BSc MSc Ph.D. at UBC ,Microbiology & Immunology/Oncology/Pathology/Physiology ,Professor ,"Kostal,Rande W ",LLB Western; OF THE LAW SOCIETY OF UPPER CANADA ; MA McMaster; Ph.D. Oxford; ,Law - Office of the Dean ,Professor ,"Koval,John Joseph ",MPhil at IMPERIAL COL ; Ph.D. at Western ; BMath MMath at WATERLOO ,Epidemiology and Biostatistics ,Professor ,"Kowalchuk,John M ","BSc, MSc Waterloo; Ph.D. McMaster; ",Kinesiology - General ,Professor ,"Kowalchuk,John M ","BSc, MSc Waterloo; Ph.D. McMaster; ",Physiology and Pharmacology ,Professor ,"Krishna,Priti ","Degree India, Ph.D. U of Calgary ",Department of Biology ,Professor ,"Kuiper,Nicholas Ahlrich ","BA ; MSc, Ph.D. Calgary; ",Psychology ,Professor ,"Kulperger,Reginald J ",Ph.D. Carleton ,Statistics & Actuarial Science ,Professor ,"Lachance,Marc-Andre ","BA, BSc Montreal; MSc McGill; Ph.D. California; The University of Western Ontario Excellence in Teaching Award (1987) ; ",Department of Biology ,Professor ,"Laird,Dale W ",MSc Ph.D. at UBC ,Anatomy & Cell Biology/Physiology and Pharmacology ,Professor ,"Lajoie,Gilles ",Ph.D. at MCGILL ; BA BSc at SHERBROOKE ,Paediatrics/Biochemistry ,Professor ,"Lapointe,Henry J ",DDS ; DIP OMSTA Toronto; ,Dentistry ,Professor ,"Laschinger,Heather ","BN, RegN New Brunswick; MEd, Ph.D. Ottawa; ",Nursing ,Professor ,"Lemon,Peter W R ","BA, BPE McMaster; MS Windsor; Ph.D. Wisconsin; ",Kinesiology - General ,Professor ,"Lennard,William N ","BA Ontario, Ph.D. USA ",Physics and Astronomy ,Professor ,"Leonard,John K ","BA, Ph.D. Cantab; MA McMaster; ",English ,Professor ,"Leschied,Alan D W ","BA, MEd, Ph.D. ; ",Education - Office of the Dean ,Professor ,"Leung,Lai-Wo ",BS at CAL STATE-FULL ; Ph.D. at UCAL-BERK ,Physiology and Pharmacology ,Professor ,"Lick,David ","BA Michigan St Univ; JD, Univ of Michigan USA ",Law - Office of the Dean ,Professor ,"Ling,Charles X ","BSc Jiao-Tong; MSc, Ph.D. Pennsylvania; ",Computer Science ,Professor ,"Lingard,Lorelei Anne ",BA Western; Ph.D. Simon Fraser BC ,Education - Office of the Dean ,Professor ,"Lingard,Lorelei Anne ",BA Western; Ph.D. Simon Fraser BC ,Family Medicine - General/Department of Medicine ,Professor ,"Litchfield,David W ",BSc at MCMASTER ; Ph.D. at Western ,Biochemistry/Oncology ,Professor ,Department Chair "Lochner,Lance John ","BA Wisconsin-Madison; MA, Ph.D. Chicago; ",Economics ,Professor ,"Locke,Wendi Allison ","BA, Western ",Law - Office of the Dean ,Professor ,"Lomber,Stephen ","BS U of Rochester, Ph.D. Boston Univ ",Physiology and Pharmacology ,Professor ,"Lomber,Stephen ","BS U of Rochester, Ph.D. Boston Univ ",Psychology ,Professor ,"Longstaffe,Fred J ",BSc Windsor; Ph.D. McMaster; FRSC; PGeol; U.W.O. Distinguished Professor; ,Civil & Environmental ,Professor ,"Longstaffe,Fred J ",BSc Windsor; Ph.D. McMaster; FRSC; PGeol; U.W.O. Distinguished Professor; ,Earth Sciences ,Professor ,"Longstaffe,Fred J ",BSc Windsor; Ph.D. McMaster; FRSC; PGeol; U.W.O. Distinguished Professor; ,Anthropology ,Professor ,"Lupker,Stephen J ","BS, MS, Ph.D. Wisconsin; ",Psychology ,Professor ,"Lutfiyya,Hanan ",BSc Yarmouk; MSc Iowa; Ph.D. Missouri-Rolla; ,Computer Science ,Professor ,Department Chair "MacDougall-Shackleton,Scott ","BSc, MSc Queen's; MA, Ph.D. John Hopkins; ",Psychology ,Professor ,"Madhavji,Nazim H. ","BSc Essex; MSc, Ph.D. Manchester; ",Computer Science ,Professor ,"Mahon,Jeffrey L ",FRCPCan BSc MD at ALBERTA ; MSc at Western ,Epidemiology and Biostatistics/Department of Medicine ,Professor ,"Mahon,Patrick L ",BFA Manitoba; MFA UBC; ,Visual Arts ,Professor ,"Malczewski,Jacek ","MSc, Ph.D. Poland; ",Geography ,Professor ,"Malthaner,Richard A ",FRCSCan FRCPCan FCCP FACS BSc MD at TORONTO ; MSc at Western ,Epidemiology and Biostatistics/Surgery ,Professor ,"Martin,Rod ","BA, MA, Ph.D. Waterloo; ",Psychology ,Professor ,"Martin,Ruth E ",BA Queen's; MHSc Toronto; Ph.D. Wisconsin; ,Communicative Sci & Disorders ,Professor ,"Martin,Ruth E ",BA Queen's; MHSc Toronto; Ph.D. Wisconsin; ,Otolaryngology/Physiology and Pharmacology ,Professor ,"Martino,Wayne J ","BA Western Australia; DipEd, BEd, MEd, Ph.D. Murdoch, Western Australia ",Womens' Studies ,Professor ,"Martino,Wayne J ","BA Western Australia; DipEd, BEd, MEd, Ph.D. Murdoch, Western Australia ",Education - Office of the Dean ,Professor ,"McBean,Gordon ","BSc, Ph.D. UBC; MSc McGill; ",Science - Office of the Dean ,Professor ,Co-Director "McBean,Gordon ","BSc, Ph.D. UBC; MSc McGill; ",Geography ,Professor ,"McDonald,John W ",Ph.D. Canada ,Department of Medicine ,Professor ,"McKechnie,Evelyn Frances ",BA Manitoba; MLS Toronto; Ph.D. Western; ,Info & Media Studies - General ,Professor ,"McLaren,Richard H ","HBA, LLB Western; OF THE LAW SOCIETY OF UPPER CANADA ; LLM London; ",Law - Office of the Dean ,Professor ,"McLeod,A Ian ","BMATH, MMATH, Ph.D. Waterloo; ",Statistics & Actuarial Science ,Professor ,"McNeil,Jeremy ","BA Ontario, Ph.D. North Carolina State U ",Department of Biology ,Professor ,"McRae,Ken ","BSc Queen's; MSc, Ph.D. McGill; ",Psychology ,Professor ,"McWilliam,Carol L ","BN, RegN New Brunswick; MScN Western; EdD Toronto; ",Nursing ,Professor ,"Meakin,Susan ",BSc at GUELPH ; MSc Ph.D. at TORONTO ,Biochemistry/Molecular Brain Research Group ,Professor ,"Menon,Ravi ",Ph.D. at ALBERTA ; MSc at MCGILL ; BSc at UBC ,Medical Biophysics/Department of Medical Imaging/Psychiat ,Professor ,"Mercer,Robert E ","Degree Alberta, Ph.D. UBC ",Computer Science ,Professor ,"Meredith,Victoria ",BMED Indiana; DMA Arizona; MMUS Northern Colorado; ,Music - Office of the Dean ,Professor ,Associate Dean (Ugrd Program)/Undergraduate Chair "Merritt,David R ",BFA Western; MFA NSCAD; ,Visual Arts ,Professor ,"Meyer,John Peter ","BA, MA, Ph.D. ; ",Psychology ,Professor ,"Mihailescu,Calin-Andrei ","BA Bucharest; MA, Ph.D. Toronto; ",Modern Languages & Literatures ,Professor ,"Millar,John S ","BSc, MSc British Columbia; Ph.D. Alberta; ",Department of Biology ,Professor ,"Min,Wei-Ping ",Ph.D. at KYUSHU DAIGA ,Oncology/Pathology/Surgery ,Professor ,"Minac,Jan ","BA, RNDR Comenius(Bratislava); Ph.D. Queen's; USC Award of Excellence in Teaching (1997) ",Computer Science/Mathematics ,Professor ,"Miransky,Volodymyr ","Masters, UKR; Ph.D., Inst for Theor. Physics, RUS ",Physics and Astronomy/Applied Mathematics ,Professor ,"Mittler,Silvia ",BSc MSc Ph.D. at MAINZ ,Electrical & Computer ,Professor ,"Mittler,Silvia ",BSc MSc Ph.D. at MAINZ ,Medical Biophysics ,Professor ,"Mittler,Silvia ",BSc MSc Ph.D. at MAINZ ,Physics and Astronomy ,Professor ,"Molto,Eldon ","BA McMaster; MA, Ph.D. Toronto; ",Anthropology ,Professor ,"Moran,Greg ","BSc McGill; MA, Ph.D. Dalhousie; ",Psychology ,Professor ,"Morrow,L Donald ","BA, MA ; Ph.D. Alberta; ",Kinesiology - General ,Professor ,"Mottola,Michelle F ",MSc Ph.D. at ALBERTA ; BA at Western ,Kinesiology - General ,Professor ,"Mottola,Michelle F ",MSc Ph.D. at ALBERTA ; BA at Western ,Anatomy & Cell Biology ,Professor ,"Mueser,Martin H. ","MA Germany, Ph.D. Johannes Gutenberg U Germany ",Physics and Astronomy ,Professor ,"Murdoch,Duncan J ","BMATH Waterloo; MSc, Ph.D. Carleton; ",Statistics & Actuarial Science ,Professor ,"Mymryk,Joseph ",BSc Ph.D. at MCMASTER ,Microbiology & Immunology/Oncology/Otolaryngology ,Professor ,"Nakhla,George ","BSc, Sudan; MS, Ph.D., Illnois; P.Eng. ",Chemical &Biochem Engineering/Civil & Environmental ,Professor ,"Narayanan,Njanoor ",MSc Ph.D. at BOMBAY ; BSc at KERALA ,Physiology and Pharmacology ,Professor ,"Neff,Bryan David Tyson ","BSc, Ph.D. Toronto; ",Department of Biology/Science - Office of the ,Professor ,Associate Dean (Research) "Nehdi,Moncef ","BASC, Laval; MASc, Sherbrooke; Ph.D., British Columbia; P.Eng. ",Civil & Environmental ,Professor ,"Neufeld,Richard W ",BA at ALBERTA ; MSc Ph.D. at CALGARY ,Psychiatry ,Professor ,"Neufeld,Richard W ",BA at ALBERTA ; MSc Ph.D. at CALGARY ,Psychology ,Professor ,"Neyers,Jason W ",BA Western; LLB McGill; MST Oxon; ,Law - Office of the Dean ,Professor ,"Nicholls,Christopher C ",BA (Hons) Ottawa; LLB New York; LLM York; M.P.A. Harvard ,Law - Office of the Dean ,Professor ,"Noble,Earl ","BSc, MSc Waterloo; Ph.D. Washington State; ",Kinesiology - General ,Professor ,School Director "Noriega,Teobaldo A ","BA Columbia, Ph.D. Alberta ",Modern Languages & Literatures ,Professor ,"Norman,Ross ",BA at MEMORIAL ; Ph.D. at MICHIGAN ,Epidemiology and Biostatistics/Psychiatry ,Professor ,"Norman,Ross ",BA at MEMORIAL ; Ph.D. at MICHIGAN ,Psychology ,Professor ,"O'Reilly,Justice James Wilson ","BA, Western; LLM, Univ of Ottawa ",Law - Office of the Dean ,Professor ,"Olson,James M ","BA, MA Carleton; Ph.D. Waterloo; ",Psychology ,Professor ,"Orange,Joseph B ",BSc Queen's; MHSc Toronto; Ph.D. Buffalo; ,Communicative Sci & Disorders ,Professor ,"Ossenkopp,Peter ","BA, MA Manitoba; Ph.D. York; ",Psychology ,Professor ,"Owen,Adrian ",BS Univ College London GBR; Ph.D. U of London GBR ,Anatomy & Cell Biology/Physiology and Pharmacology ,Professor ,"Owen,Adrian ",BS Univ College London GBR; Ph.D. U of London GBR ,Psychology ,Professor ,"Paetzold,Matthias ",,Electrical & Computer ,Professor ,"Pagenkopf,Brian L ",BSc Minnesota; Ph.D. Montana State ,Chemistry ,Professor ,"Paquette,Jerald ","BA St Thomas; BEd, MEd Lakehead; Ph.D. Toronto; ",Education - Office of the Dean ,Professor ,"Parr,Joy ","BA McGill, MA Ph.D. Yale ",Geography ,Professor ,"Patel,Rajnikant V ","BEng, Liverpool; Ph.D., Cambridge; P.Eng. ",Electrical & Computer ,Professor ,"Patel,Rajnikant V ","BEng, Liverpool; Ph.D., Cambridge; P.Eng. ",Surgery ,Professor ,"Paterson,Donald H ",BSc York(Can); MA ; Ph.D. Toronto; ,Kinesiology - General ,Professor ,"Paunonen,Sampo V ","BA, MA, Ph.D. ; ",Psychology ,Professor ,"Pennee,Donna J ","BA, MA Guelph; Ph.D. McGill ",English/Womens' Studies ,Professor ,"Perez,Andres ",BA Nicaragua; MPA California; Ph.D. Carleton; ,Political Science ,Professor ,