Name,Degrees,Department,Department2,Rank,AdministrativePosition,Faculty"Leipert,Beverly D ","BA, BScN, RegN Saskatchewan; MScN UBC; Ph.D. Alberta; ",Nursing ,,Associate Professor ,,Health Sciences"Leitch,Kellie ",Professional Univ of Torontooronto; Bachelors Canada ,Business - Associate Dean ,,Associate Professor/MD ,Dean ,Ivey"Leith,J.Clark ","BA Toronto; MA, Ph.D. Wisconsin; ",Economics ,,Professor Emeritus ,,Social Science"Leizerovici,Gail ","BA, Univ of Guelph; MS, Univ of Guelph ",Bachelor of Mgmt & Org Studies ,,Lecturer ,,Social Science"Lemarquand,David Gordon ",Ph.D. at MCGILL ; BA at WATERLOO ,Psychology ,Psychiatry ,Adjunct Clinical Professor ,,Social Science"Lemire,Nicole ","BSc Windsor; MSc, Ph.D. Alberta; ",Mathematics ,,Associate Professor ,,Science"Lemon,Peter W R ","BA, BPE McMaster; MS Windsor; Ph.D. Wisconsin; ",Kinesiology - General ,,Professor ,,Health Sciences"Lemos,Tracy ",#N/A ,Womens' Studies ,,Assistant Professor ,,Arts & Humanities"Lennard,William N ","BA Ontario, Ph.D. USA ",Physics and Astronomy ,,Professor ,,Science"Lennon,Madeline ","BA New Rochelle; MA, Ph.D. Toronto; THE UNIVERSITY OF WESTERN ONTARIO EXCELLENCE IN TEACHING AWARD (1990) ; ",Visual Arts ,,Professor Emerita ,,Arts & Humanities"Lennon,Thomas M ",BA Manhattan; Ph.D. Ohio State; ,Philosophy ,,Professor Emeritus ,,Arts & Humanities"Lent,Barbara Pauline ",FCFPC MA MD at Western ; BA at YORK ,Family Medicine ,,Professor/MD ,,Schulich"Lenz,Alfred C. ","BSc, MSc Alberta; Ph.D. Princeton; ",Earth Sciences ,,Professor Emeritus ,,Science"Leonard,John K ","BA, Ph.D. Cantab; MA McMaster; ",English ,,Professor ,,Arts & Humanities"Leonard,Liana Michelle ","BSN, Western ",Nursing ,,Lecturer ,,Health Sciences"Leong-Sit,Peter ",BSc /MD UBC ,Department of Medicine ,,Assistant Professor/MD ,,Schulich"Leong,Hon ","BS., Univ of Alberta; Ph.D., UBC ",Oncology ,,Adjunct Professor ,,Schulich"Lepage,Patricia ","BA, Laurentian Univ; MD mcMaster Univ ",Psychiatry - Ext Camp Program ,,Adjunct/MD ,,Schulich"Leschied,Alan D W ","BA, MEd, Ph.D. ; ",Education - Office of the Dean ,,Professor ,,Education"Leslie,Kenneth A ",FRCSCan MD at Western ,Surgery ,,Associate Professor/MD ,Division Chair ,Schulich"Lester,Benjamin R ",BA Cornell; Ph.D. Pennsylvania ,Economics ,,Adjunct Research Professor ,,Social Science"Leung,Andrew Edward ",FRCP at Queen's ; MD at Western ,Clinical Neurological Science/Department of Medical Imaging ,,Associate Professor/MD ,,Schulich"Leung,Fred Y ","BSc, MSc, Ph.D. British Columbia; FCACB ",Clinical Biochemistry ,,Professor Emeritus ,,Schulich"Leung,Joe B ",BSc MD at UBC ,Obstetrics & Gynaecology/Schulich - Education Office ,,Adjunct/MD ,,Schulich"Leung,Lai-Wo ",BS at CAL STATE-FULL ; Ph.D. at UCAL-BERK ,Physiology and Pharmacology ,,Professor ,,Schulich"Leung,Wai Ming ",MD at TORONTO ,Department of Medicine/Schulich - Education Office ,,Adjunct/MD ,,Schulich"Levesque,Lenerdene Audrey ","BSPT., Queen's Univ; MSc., Western ",Physical Therapy ,,Lecturer ,,Health Sciences"Levin,Morris F ",FRCPCan MBBCh at WITWATERSRAN ,Department of Medical Imaging ,,Adjunct/MD ,,Schulich"Levin,Simon D ",FRCPCan MBChB at BIRMINGHAM ,Clinical Neurological Science/Paediatrics ,,Associate Professor ,,Schulich"Levine,Charles G ","BA, MA McMaster; Ph.D. Alberta; ",Sociology ,,Associate Professor ,Undergraduate Chair ,Social Science"Levine,Gregory J ",BA Manitoba; Ph.D. Ontario ,Geography ,,Assistant Professor ,,Social Science"Levine,Meredith ",BA Queen's; MA Carleton; ,Info & Media Studies - General ,,Lecturer ,,Information & Media Studies"Levstik,Mark A ",MD at IRELAND-Duplic ; BSc at Western ,Department of Medicine ,,Associate Professor/MD ,,Schulich"Levy,Donald M ",HBSc MD CCFP CCFP(EM) at DALHOUSIE ,Department of Medicine/Schulich - Education Office ,,Adjunct/MD ,,Schulich"Lewell,Michael Peter ",FRCP BSc at NEW BRUNSWIC ; MD at Western ,Department of Medicine ,,Associate Professor/MD ,,Schulich"Lewis,Craig Edward ",BSc at GUELPH ; MSc at Western ,Medical Biophysics/Oncology ,,Adjunct Professor ,,Schulich"Lewis,James Franklin ",FRCPCan MD at Western ,Department of Medicine/Physiology and Pharmacology ,,Professor/MD ,,Schulich"Lewis,John D ",BS at Western ; Ph.D. at VICTORIA ,Medical Biophysics/Oncology/Surgery ,,Assistant Professor ,,Schulich"Lewis,Laura Elizabeth ",Ph.D. USA ,Family Medicine - General ,,Lecturer ,,Schulich"Lewis,Leslie A. ",BSc DDS at Western ,Dentistry ,,Adjunct Clinical Professor ,,Schulich"Lewis,Sheldon D ",BS McGill Univ; MD U of Ottawa ,Department of Medicine/Schulich - Education Office/Schulich ,,Adjunct/MD ,Course Coordinator ,Schulich"Ley,John P ",DDS at ALBERTA ; BSc at Western ,Dental Clinics ,,Adjunct Clinical Professor ,,Schulich"Leyshon,Glynn ",BA ; MS Illinois; Ph.D. Oregon; ,Health Sciences- Dean's Office ,,Professor Emeritus ,,Health Sciences"Li,Mok-Dock D ",MB National Taiwan; FRCPCan ,Paediatrics ,,Professor Emeritus ,,Schulich"Li,Rong-Yu ",BS Peking Univ China; Ph.D. U of Alberta ,Earth Sciences ,,Adjunct Research Professor ,,Science"Li,Shun-Cheng ",BSc at PEKING ; MSc at SHANGHAI ; Ph.D. at TORONTO ,Oncology/Biochemistry ,,Associate Professor ,,Schulich"Li,Shuo ",MEng at ANHUI ; BEng at CHINESE ACAD ; Ph.D. at CONCORDIA ,Department of Medical Imaging/Medical Biophysics ,,Adjunct Research Professor ,,Schulich"Li,Zhichuan ","BS, Shanghai Univ, CHN; Ph.D. Arizona State Univ, USA ",Business - Associate Dean ,,Assistant Professor ,,Ivey"Liambou,Ghislain ","MA, McMaster Univ ",French Studies ,,Lecturer ,,Arts & Humanities"Liang,Hsien C ",MD at TORONTO ,Family Medicine - General/Schulich - Education Office/Schulic ,,Adjunct/MD ,Course Coordinator ,Schulich"Libman,Rick ",BA York; LLM Osgoode; OF THE LAW SOCIETY OF UPPER CANADA ; ,Law - Office of the Dean ,,Lecturer ,,Law"Lick,David ","BA Michigan St Univ; JD, Univ of Michigan USA ",Law - Office of the Dean ,,Professor ,,Law"Licskai,Christopher J. ",FRCP BSc at MCMASTER ; MD at TORONTO ,Department of Medicine ,,Associate Professor/MD ,,Schulich"Liebman,Shael M. ",BPhEd MD at TORONTO ,Surgery/Schulich - Education Office ,,Adjunct/MD ,,Schulich"Liem,Joel J ",MD at OTTAWA ; BSc at WINDSOR ,Paediatrics/Schulich - Education Office ,,Adjunct/MD ,,Schulich"Liem,Nathania R ",MSc MD at OTTAWA ; BSc at WINDSOR ,Physical Medicine and Rehab/Schulich - Education Office ,,Adjunct/MD ,,Schulich"Lim,Rodrick ",MD at Queen's ,Paediatrics ,,Associate Professor/MD ,,Schulich"Lin,Charles Gordon ","Professional, ON ",Dental Clinics ,,Adjunct Clinical Professor ,,Schulich"Lindo,Zoe ",BS U of Calgary; Ph.D. U of Victoria ,Biology ,,Assistant Professor ,,Science"Lindsay,Christopher Sean ","BS, MD Western ",Surgery ,,Adjunct/MD ,,Schulich"Lindsay,Peter Alfred ",MD at TORONTO ; FRCPCan at Western ,Anesthesia-Perioperative Med ,,Adjunct/MD ,,Schulich"Lindsay,Robert M ",FRCP at EDINBURGH ; MBChB MD FRCP at GLASGOW ,Department of Medicine ,,Professor/MD ,,Schulich"Ling,Charles X ","BSc Jiao-Tong; MSc, Ph.D. Pennsylvania; ",Computer Science ,,Professor ,Department Chair ,Science"Ling,Francis ",BS Ottawa; MD Univ of Torontooronto ,Otolaryngology/Schulich - Education Office ,,Adjunct/MD ,,Schulich"Ling,Hong ",Ph.D. at ALBERTA ; BS MS at GEOSCIENCES ,Biochemistry ,,Associate Professor ,,Schulich"Ling,Paul Hwa-Sinn ",DDS at Western ,Dental Clinics ,,Adjunct Clinical Professor ,,Schulich"Lingard,Lorelei Anne ",BA Western; Ph.D. Simon Fraser BC ,Education - Office of the Dean ,Family Medicine - General/Department of Medicine ,Professor ,,Education"Links,Paul ","BMS and MD, Univ of Alberta ",Psychiatry/Psychiatry - Ext Camp Program/Schulich - Office of ,,Professor/MD ,Department Chair/Program Director ,Schulich"Linn,Thomas G ",Ph.D. at HARVARD ; BSc at MINNESOTA ,Microbiology & Immunology ,,Associate Professor ,,Schulich"Linnen,Robert ","BSc Queen's; MSc, Ph.D. McGill ",Earth Sciences ,,Associate Professor ,,Science"Linton,Leslie ","BMUS, BED, MMUS Western ",Education - Preservice Office ,,Lecturer ,,Education"Liolli,Americo ",BSc at MCMASTER ; MD at TORONTO ,Anesthesia-Perioperative Med/Schulich - Education Office ,,Adjunct/MD ,,Schulich"Lipson,Robert H ","BSc, MSc, Ph.D. Toronto; ",Chemistry ,,Adjunct Research Professor/Professor Emeritus ,,Science"Litchfield,David W ",BSc at MCMASTER ; Ph.D. at Western ,Biochemistry/Oncology ,,Professor ,,Schulich"Litchfield,Robert B ",FRCPCan MD at Western ,Surgery ,,Associate Professor/MD ,,Schulich"Litman,Larry C ",MA at GUELPH ; BA Ph.D. at YORK ,Psychiatry ,,Adjunct Assistant Professor ,,Schulich"Little,Blair ","BA British Columbia, Professional USA ",Business - Associate Dean ,,Professor Emeritus ,,Ivey"Little,Gwenlynn ",Professional Designation ON ,Music - Performance Studies ,,Lecturer ,,Music"Littlewood,Antony R ",BA Leeds; BLITT Oxon; ,Classical Studies ,,Professor Emeritus ,,Arts & Humanities"Liu,Mark X ","BEng Northeastern Univ China, MEng/Ph.D. Univ of Tokyo Japan ",Civil & Environmental ,,Adjunct Research Professor ,,Engineering"Liu,Selina ",MSC Western ,Department of Medicine ,,Adjunct/MD ,,Schulich"Liu,Xiaoming ","BSc Nanchang Inst China, Ph.D. Univ of Toronto ",Statistics & Actuarial Science ,,Associate Professor ,,Science"Liu,Zheng ",BA Manitoba; Ph.D. Ontario ,Bachelor of Mgmt & Org Studies ,,Assistant Professor ,,Social Science"Livshits,Igor D ","BS, MS Belarusian State Polytechnic Academy; MS Illinois Urbana-Champaign; Ph.D. Minnesota; ",Economics ,,Associate Professor ,Graduate Chair ,Social Science"Liwanpo,Paul T ",MBChB St Andrews ,Department of Medicine/Schulich - Education Office ,,Adjunct/MD ,,Schulich"Lloyd,David A ",MBBCh Witwatersrand; FRCPCan ,Department of Medicine ,,Professor Emeritus ,,Schulich"Lo,Kwan-Yee Y. ",Ph.D. Univ of London England ,Civil & Environmental ,,Adjunct Research Professor/Professor Emeritus ,,Engineering"Lo,Theodore Ching Yang ",BSc at MANITOBA ; Ph.D. at TORONTO ,Biochemistry ,,Professor Emeritus ,,Schulich"Lobb,Trevor R ",FRCPCan MD at Western ,Anesthesia-Perioperative Med ,,Associate Professor/MD ,,Schulich"Lochner,Lance John ","BA Wisconsin-Madison; MA, Ph.D. Chicago; ",Economics ,,Professor ,,Social Science"Lock,Michael ",HBSc MD at MCMASTER ; CCFP FRCPCan at TORONTO ,Medical Biophysics/Oncology ,,Associate Professor ,,Schulich"Locke,Marjorie Elizabeth Osborn ",BS Western ,Computer Science ,,Lecturer ,,Science"Locke,Michael ","MA, Ph.D., Sc.D., Cambridge ",Biology ,,Professor Emeritus ,,Science"Locke,Wendi Allison ","BA, Western ",Law - Office of the Dean ,,Professor ,,Law"Loebach,Paul M ",BSc MD Western ,Family Medicine - General/Schulich - Education Office ,,Adjunct/MD ,,Schulich"Loft,Maureen Anne ",BScN Western ,Nursing ,,Adjunct Assistant Professor ,,Health Sciences"Lofts,Stephen G ","BA Univ of Toronto, Ph.D. U Catholique De Lou ",Modern Languages & Literatures ,,Adjunct Associate Professor ,,Arts & Humanities"Logan,Diane ",MD FRCPCan at OTTAWA ,Oncology ,,Associate Professor/MD ,,Schulich"Loh,Eldon ",BS Univ of Torontooronto; MD Western ,Physical Medicine and Rehab ,,Assistant Professor/MD ,,Schulich"Lohman,Eric ",BScN Western ,Info & Media Studies - General ,,Lecturer ,,Information & Media Studies"Lohrenz,John G. ",MD Montreal; FRCPCan ,Psychiatry ,,Professor Emeritus ,,Schulich"Lomber,Stephen ","BS U of Rochester, Ph.D. Boston Univ ",Psychology ,Physiology and Pharmacology ,Professor ,,Social Science"London,Norrel A ",BA Manitoba; MA McGill; MEd Queen's; Ph.D. Wisconsin (Madison) ,Education - Office of the Dean ,,Professor Emeritus ,,Education"Long,Douglas G ","BA, MA Toronto; Ph.D. London; ",Political Science ,,Associate Professor ,,Social Science"Longstaffe,Fred J ",BSc Windsor; Ph.D. McMaster; FRSC; PGeol; U.W.O. Distinguished Professor; ,Earth Sciences ,Civil & Environmental ,Professor ,,Science"Longtin,Mario ",BA; MA McGill; MSc Ph.D. Universite_ d'Edinburg; ,French Studies ,,Associate Professor ,,Arts & Humanities"Loo,Janet Karen ","BSc Toronto; BMUS, MMUS; ",Music - Education ,,Lecturer ,,Music"Loo,Wei Jing ",MRCP(UK) at LONDON ; MBBS at SYDNEY ,Department of Medicine ,,Adjunct/MD ,,Schulich"Lopata,Joel Alan ","BFA, York Univ; MED, Western ",Education - Preservice Office ,,Grad Student Teaching Assignmt ,,Education"Lopes,Laudelino M ",Bsc U of Washington USA; Ph.D. U Federal Rio de Jan BRAZIL ,Obstetrics & Gynaecology ,,Associate Professor/MD ,Division Head ,Schulich"Lopez Diaz,Carlos Alfonso ","DDS, Western ",Dental Clinics ,,Adjunct Clinical Professor ,,Schulich"Lopez Gross,Jacqueline ","BDS., Universidad Gran Mariscal, VEN; DMD, Universidad Central De Ve, VEN ",Dentistry ,,Adjunct Clinical Professor ,,Schulich"Loree,David W ",BS Bradley; MBA Dallas; Ph.D. Univ of Torontoexas at Dallas; ,Business - Associate Dean ,,Assistant Professor ,,Ivey"Lorimer,John W. ","BA, MA, Ph.D. Toronto; ",Chemistry ,,Professor Emeritus ,,Science"Loubani,Mohammed M. ",BS Dalhouse Univ NV; MD Western ,Department of Medicine ,,Assistant Professor/MD ,,Schulich"Loubani,Tarek ","BS Dalhousie, MD Western ",Department of Medicine ,,Assistant Professor/MD ,,Schulich"Loudermilk,Margaret ","BA, Boston Univ, USA; Ph.D., Michigan State Univ, USA ",Economics ,,Assistant Professor ,,Social Science"Loupos,Dean Nicholas ","HBA, MED Western ",Education - Preservice Office ,,Lecturer ,,Education"Louzada,Martha ",BA Fed Univ-rio de Janeiro Brazil; MD Fundacao Souza Marques Univ Brazil ,Department of Medicine ,,Assistant Professor/MD ,,Schulich"Loveday,Benjamin Douglas ","BSc Western, MD Western ",Psychiatry ,,Assistant Professor/MD ,,Schulich"Loveland,Michelle M. ","BEd, HBA, CA; ",Bachelor of Mgmt & Org Studies ,,Lecturer ,,Social Science"Lovesey,Natalie ","BS Dalhousie, MD Nova Scotia ",Family Medicine - General/Schulich - Office Gbl Health ,,Adjunct/MD ,,Schulich"Lovett,Erin Patricia ",BS U of Alberta; MD Western ,Obstetrics & Gynaecology ,,Assistant Professor/MD ,,Schulich"Lowcock,Janet Elizabeth ","HBA, MED Western ",Physical Therapy ,,Lecturer ,,Health Sciences"Lowe,Robert P ",Ph.D. Ontario ,Physics and Astronomy ,,Adjunct Research Professor/Professor Emeritus ,,Science"Lownie,Stephen Patrick ",FRCSCan BSc MD at DALHOUSIE ,Department of Medical Imaging/Otolaryngology/Clinical Neu ,,Professor/MD ,,Schulich"Lowrey,Parker Eastin ","BS, Tulane, USA; Ph.D., Univ of Texas at Austin, USA ",Mathematics ,,Assistant Professor ,,Science"Lowrie,Dean A ",BA Mantioba; MPE Alberta; ,Kinesiology - General ,,Lecturer ,,Health Sciences"Lowry,Karen Elizabeth ",BSc (CD) Western ,Communicative Sci & Disorders ,,Adjunct Clinical Professor ,,Health Sciences"Lozanski,Kristin ",Ph.D. U of Alberta ,Womens' Studies ,,Assistant Professor ,,Arts & Humanities"Lozon,Alan M ",MD at OTTAWA ; BSc at Western ,Surgery/Schulich - Education Office ,,Adjunct/MD ,,Schulich"Lu,Wei-Yang ",Ph.D. at MEMORIAL ; MD MSc at SHANDONG ,Physiology and Pharmacology/Molecular Brain Research Gro ,,uAssociate Professor ,,Schulich"Lubansky,Joanne Evelyn ",BS (Nursing) Western; RN Flushing Hospital USA ,Nursing ,,Lecturer ,,Health Sciences"Lubell,Richard ",FRCP FRCPCan BA MD at Western ,Paediatrics ,,Associate Professor/MD ,,Schulich"Lubynski,Rosemary ",MD at CAPE TOWN ,Pathology ,,Adjunct/MD ,,Schulich"Luckman,Brian ","BA, MA Manchester; Ph.D. McMaster; ",Geography ,,Professor Emeritus ,,Social Science"Lucy,Deborah S ","BSc(PT), MCLSC, Ph.D. ; ",Physical Therapy ,,Associate Professor ,School Director ,Health Sciences"Luginaah,Isaac ",BSc; MSc; MES; Ph.D. McMaster; ,Geography ,,Associate Professor ,,Social Science"Lui,Edmund M ",BSc MSc Ph.D. at DALHOUSIE ,Physiology and Pharmacology ,,Associate Professor ,,Schulich"Luke,Patrick P W ",MD at TORONTO ; FRCSCan at Western ,Surgery ,,Professor/MD ,,Schulich"Luke,Trevor M ","BSc Queen's; MSc, Ph.D. McGill; ",Applied Mathematics ,,Professor Emeritus ,,Science"Lukis,Angela ",BSW MSW at WINDSOR ,Psychiatry - Ext Camp Program ,,Lecturer ,,Schulich"Lum,P Andrea ",FRCP MD at OTTAWA ; BSc at Queen's ,Department of Medical Imaging ,,Associate Professor/MD ,Clinical Department Chair ,Schulich"Lunau,Dennis Ray ",BA Western ,Education - Preservice Office ,,Lecturer ,,Education"Lundberg,Kim Torkelsson ",BMUS Saskatchewan; MMUS ; ,Music - Office of the Dean ,,Lecturer ,,Music"Lundgren,Bruce R ","BA Manitoba; MA, Ph.D. ; ",English ,,Professor Emeritus ,,Arts & Humanities"Luo,Yigang ",MD at WEST CHINA ,Schulich - Education Office ,,Adjunct/MD ,,Schulich"Lupker,Stephen J ","BS, MS, Ph.D. Wisconsin; ",Psychology ,,Professor ,,Social Science"Lupovitch,Howard ","BA U of Michigan, Ph.D. Columbia Univ USA ",History ,,Associate Professor ,,Social Science"Luryi,Yuri ",DIPLOMA AND DEGREE IN LAW Moscow; JURIST USSR; ,Law - Office of the Dean ,,Professor Emeritus ,,Law"Lutfiyya,Hanan ",BSc Yarmouk; MSc Iowa; Ph.D. Missouri-Rolla; ,Computer Science ,,Professor ,,Science"Luton,Kim ","BA, MA Western; ",Sociology ,,Lecturer ,,Social Science"Luyt,Leonard G ","BA, Ph.D. Ontario ",Chemistry ,Department of Medical Imaging/Oncology ,Assistant Professor ,,Science"Lynch,Tim ",FRCP MD at MEMORIAL ; BSc at NEW BRUNSWIC ,Paediatrics ,,Associate Professor/MD ,,Schulich"Lynk,S. Michael ","BA, LLB Dalhousie; LLM Queen's; OF THE LAW SOCIETY OF UPPER CANADA AND THE NOVA SCOTIA BARRISTERS' SOCIETY ; ",Law - Office of the Dean ,,Associate Professor ,,Law"Lyons,Christopher ",MA Univ of New Brunswick ,Education - Preservice Office ,,Grad Student Teaching Assignmt ,,Education"Lyons,Laura Myerling Isabel ",CCFP MD at MCMASTER ,Family Medicine ,,Assistant Professor/MD ,Centre Director ,Schulich"Lyons,Lisa M ","BA, MA Western ",Sociology ,,Lecturer ,,Social Science"Lyttle,Brian Douglas ",FRCPCan BA MD at Western ,Paediatrics ,,Assistant Professor/MD ,,Schulich"Ma,Bin ","BA, Ph.D. Peking; ",Computer Science ,,Adjunct Research Professor ,,Science"Ma,Shengwu ","BSc, MSc Nankai (China); Ph.D. Carleton ",Biology ,Department of Medicine ,Adjunct Research Professor ,,Science"Macaluso,Steven ","BS, MD, Western ",Physical Medicine and Rehab ,,Assistant Professor/MD ,,Schulich"MacDermid,Joy C ","BA Ontario, Ph.D. NS ",Surgery ,,Assistant Professor ,,Schulich"Macdonald,Alison Heather ",BS Wilfrid Laurier; MD McMaster univ ,Obstetrics & Gynaecology/Schulich - Education Office ,,Adjunct/MD ,,Schulich"MacDonald,Christine Anne ",BSc Western; MD Univ of Toronto ,Department of Medicine ,,Assistant Professor/MD ,,Schulich"Macdonald,David R ",FRCPCan MD at Western ; BA at WATERLOO ,Oncology ,,Associate Professor/MD ,,Schulich"MacDonald,Don ",BA Western ,Business - Associate Dean ,,Lecturer ,,Ivey"MacDonald,Ian C ","Ph.D. at Univ of London, UK ; BSc at Western ",Medical Biophysics ,,Professor Emeritus ,,Schulich"MacDonald,John F ",BS Ph.D. at UBC ,Anatomy & Cell Biology/Clinical Neurological Science/Physiol ,,oProfessor ,,Schulich"MacDonald,Leigh M ",BA Western; MA Toronto; ,Economics ,,Lecturer ,,Social Science"MacDonald,Michael G ","BA U of Windsor, Ph.D. U of Calgary ",Psychology ,Education - Preservice Office/Education - Graduate Education ,Assistant Professor ,,Social Science"MacDonald,Pat Anne ","MBA, Ph.D. Western ",Business - Associate Dean ,,Assistant Professor ,,Ivey"MacDonald,Penny ",BS Univ of Toronto; MD McMaster Univ ,Clinical Neurological Science ,,Assistant Professor/MD ,,Schulich"Macdonald,Rebecca Amy ","Bachelors, Other Canada ",Earth Sciences ,,Lecturer ,,Science"MacDonald,Steven J ",FRCSCan MD at TORONTO ; BSc at Western ,Surgery ,,Professor/MD ,,Schulich"MacDonald,Tim L ",BS MD at Western ,Family Medicine - General ,,Adjunct/MD ,,Schulich"MacDougall Shackleton,Elizabeth ",Ph.D. Princeton Univ ,Biology ,,Associate Professor ,,Science"MacDougall-Shackleton,Scott ","BSc, MSc Queen's; MA, Ph.D. John Hopkins; ",Psychology ,,Professor ,,Social Science"MacDougall,John ","BSc, MSc, Ph.D. ",Electrical & Computer ,,Adjunct Research Professor/Professor Emeritus ,,Engineering"MacDougall,Keith ","BS, Univ of Calgary; MD, Univ of Alberta ",Clinical Neurological Science ,,Assistant Professor/MD ,,Schulich"MacDougall,Robert ","BA Queen's; MA, Ph.D. Harvard; ",History ,,Associate Professor ,Graduate Chair ,Social Science"MacEachern,Alan ","BA P.E.I.; MA, Ph.D. Queen's; ",History ,,Associate Professor ,,Social Science"MacFabe,Derrick Fraser ",BS Western; MD McMaster Univ ,Psychology ,,Assistant Professor ,,Social Science"MacFadyen,Joshua Donald ","Ph.D., Univ of Guelph ",History ,,Post Doctoral Teaching Assign ,,Social Science"Macfie,Sheila M. ","BSc, MSc Queen's; Ph.D. Alberta; Faculty of Science Teaching Excellence Award (2002); The Marilyn Robinson Award for Excellence in Teaching (2003); ",Biology ,,Associate Professor ,,Science"MacGee,Jim ","BBA, MA New Brunswick; Ph.D. Minnesota; ",Economics ,,Associate Professor ,Program Director ,Social Science"MacGregor,Joann Raphael ","B.SC., Western; B.Ed., Western; M.Ed., Western ",Education - Continuing Educ ,,Lecturer ,,Education"Machu,Francois Xavier ","MBA, Ph.D. Western ",Mathematics ,,Assistant Professor ,,Science"Macisaac,Allan ","BSc St. Francis Xavier; MSc, Ph.D. Memorial; ",Applied Mathematics ,,Assistant Professor ,,Science"MacIsaac,M. ","BS., St. Francis Xavier Univ; MD Dalhousie Univ NS ",Department of Medicine/Schulich - Education Office ,,Adjunct/MD ,,Schulich"Maciver,Angus Graham ",MD Western ,Surgery/Schulich - Education Office ,,Adjunct/MD ,,Schulich"Mack,Peter Haworth ",BS Univ of Torontooronto; MD Western ,Anesthesia-Perioperative Med ,,Assistant Professor/MD ,,Schulich"MacKenzie,Mary ",FRCPCan FRCP BSc MD MD at DALHOUSIE ; FRCPCan at MCMASTER ,Oncology ,,Assistant Professor/MD ,,Schulich"Mackenzie,Rob ","BS(Nursing) Western, MS (Nursing) U of Windsor ",Nursing ,,Adjunct Assistant Professor ,,Health Sciences"Mackenzie,Robert A ","BA, MD Saskatchewan; FRCPCan ",Department of Medical Imaging ,,Assistant Professor ,,Schulich"MacKinnon,Joyce R ",Degree QC; Ph.D. BC ,Occupational Therapy ,,Professor Emeritus ,,Health Sciences"Macklin,G Elizabeth ",MD at MCMASTER ; BA (Hon) at Queen's ; MA at YORK ,Paediatrics/Schulich - Education Office ,,Adjunct/MD ,,Schulich"MacLachlan,Bonnie C ",BA Carleton; MA Ottawa; Ph.D. Toronto; ,Classical Studies ,,Professor Emerita ,,Arts & Humanities"MacLeod,Hazel Merle ","BA, Diploma of Ed Western ",Education - Preservice Office ,,Lecturer ,,Education"MacLeod,Malcolm ",BSc MD at MCGILL ,Surgery/Schulich - Education Office ,,Adjunct/MD ,,Schulich"MacLeod,Mark D ",FRCSCan MD at Western ,Surgery ,,Associate Professor/MD ,,Schulich"MacLeod,Valerie A ",BSc BEd MD at DALHOUSIE ,Psychiatry ,,Adjunct/MD ,,Schulich"MacMaster,Elsie Eileen ",Bachelors/Masters Ontario ,Health Sciences- Dean's Office ,,Professor Emeritus ,,Health Sciences"MacMillan,J.B ",BSc MD at Western ,Obstetrics & Gynaecology ,,Associate Professor/MD ,Committee Chair/Division Head ,Schulich"MacMillan,Karen Teresa ","BA, Univ of Windsor; MASc U of Waterloo ",Bachelor of Mgmt & Org Studies ,,Lecturer ,,Social Science"MacMillan,Kathleen ","BSc., and Ph.D., Univ of Toronto ",Business - Associate Dean ,,Adjunct Research Professor ,,Ivey"Macnab,Jennifer Jayne ","Bachelors, Masters, Ph.D. Canada ",Epidemiology and Biostatistics ,,Adjunct Assistant Professor ,,Schulich"MacNeill,Ian ","BA, Univ of Sask;l MA, QU; Ph.D. Stan. ",Statistics & Actuarial Science ,,Adjunct Research Professor/Professor Emeritus ,,Science"MacPhail,Ann Heather Elizabeth ","BSc(PT), MSc, PHED; ",Physical Therapy ,,Lecturer ,,Health Sciences"MacPhee,Ian J ",MD at DALHOUSIE ; BS at PEI ,Family Medicine - General ,,Adjunct/MD ,,Schulich"Macpherson,Ewan A ","BS Queen's, Ph.D. U of Wisconsin-Madison ",Communicative Sci & Disorders/National Centre for Audiology ,,Assistant Professor ,,Health Sciences"MacRae,Duncan L ",FRCSCan FACS MD at Queen's ,Surgery/Paediatrics/Otolaryngology ,,Professor/MD ,,Schulich"MacRae,Neil D ",Ph.D. Ontario ,Earth Sciences ,,Professor Emeritus ,,Science"Maddison,Glen ",MD at OTTAWA ,Family Medicine - General ,,Adjunct/MD ,,Schulich"Madelska,Anna Aleksandra ","Professional Certificate OCAD, MFA Western ",Visual Arts ,,Lecturer ,,Arts & Humanities"Madhavji,Nazim H. ","BSc Essex; MSc, Ph.D. Manchester; ",Computer Science ,,Professor ,,Science"Madrenas,Joaquin ",MSc Ph.D. at ALBERTA ; MD at BARCELONA ,Microbiology & Immunology/Robarts - Immunology ,,Adjunct Research Professor ,,Schulich"Mady,Callie J ","BA, McGill Univ; Ph.D., Univ of Toronto ",Education - Continuing Educ ,,Assistant Professor ,,Education"Magalhaes,Lilian ","BOT, MEd, Ph.D., Brazil; ",Womens' Studies ,Occupational Therapy ,Associate Professor ,,Arts & Humanities"Magguilli,Louis D ","Professional Certificate OCAD, MFA Western ",Computer Science ,,Lecturer ,,Science"Mahar,Diane Jean ","BA British Columbia; MA, PhD Carleton; ",Nursing ,,Lecturer ,,Health Sciences"Mahmoud,Housyn ","B.Eng., Univ of Damascus; M.Eng., Western; Ph.D., Western ",Chemical &Biochem Engineering ,,Lecturer ,,Engineering"Mahmoud,Mohamed Ahmed Shaker ","BOTH, MD U of Cairo, EGY ",Department of Medicine/Family Medicine - General ,,Adjunct/MD ,,Schulich"Mahmud,Farid ","BSc Calgary, MD Alberta ",Paediatrics ,,Adjunct/MD ,,Schulich"Mahon,Jeffrey L ",FRCPCan BSc MD at ALBERTA ; MSc at Western ,Epidemiology and Biostatistics/Department of Medicine ,,Professor ,,Schulich"Mahon,Patrick L ",BFA Manitoba; MFA UBC; ,Visual Arts ,,Professor ,,Arts & Humanities"Mair,Anthony D ",BSc at MCGILL ; M.CL.D at Western ,Graduate Orthodontics ,,Adjunct Clinical Professor ,,Schulich"Majhanovich,Suzanne ","BA, MA Toronto; Ph.D. Colorado; ",Education - Office of the Dean ,,Adjunct Research Professor/Professor Emerita ,,Education"Makar,Inas H ",MD MBChB at CAIRO ,Ophthalmology/Paediatrics ,,Assistant Professor/MD ,,Schulich"Makhdoom,Sohail ",MBBS at PAKISTAN ,Psychiatry ,,Assistant Professor/MD ,,Schulich"Malagon-Lopez,Jose ","BA McGill, Ph.D. McGill ",Mathematics ,,Assistant Professor ,,Science