Name,Degrees,Department,Department2,Rank,AdministrativePosition,Faculty"Qureshi,Arif S ",MD at TORONTO ; BS at WINDSOR ,Family Medicine - General/Schulich - Education Office ,,Adjunct/MD ,,Schulich"Raaymakers,Joseph ","BS, Acadia Univ, NS; MS, Western ",Statistics & Actuarial Science ,,Lecturer ,,Science"Rab,Mohammad Abdur ","MBBS, Univ of Punjab, PAK; Ph.D., London School of Hygience, Germany ",Epidemiology and Biostatistics/Schulich-IDI-PublicHealthTran ,,sProfessor ,,Schulich"Rabenstein,Stephanie ",MS at GUELPH ; BSc at RHODE ISLAND ,Psychiatry ,,Lecturer ,,Schulich"Rabheru,Rita ",BA India; Professional Nova Scotia ,Family Medicine - General ,,Adjunct/MD ,,Schulich"Rachinsky,Irina ",MD MSc at BEN GURION ,Department of Medical Imaging ,,Associate Professor/MD ,,Schulich"Rachinsky,Maxim L ",MD at ST.PETERSBURG ,Anesthesia-Perioperative Med ,,Associate Professor/MD ,,Schulich"Racknor,Christopher Donald Calder ",BS Acadia; MD Dalhousie ,Physics and Astronomy ,,Lecturer ,,Science"Racz,Heather ","BS, MD Queen's ",Department of Medicine ,,Adjunct/MD ,,Schulich"Radcliffe,David J ","BA, MA Cantab; MA, Ph.D. Wisconsin; PGCE London; ",Education - Office of the Dean ,,Professor Emeritus ,,Education"Radcliffe,Vaughan S ","BSc, MSc Manchester; Ph.D. Alberta; ",Business - Associate Dean ,,Associate Professor ,,Ivey"Radford,Connie ","BScN, Western ",Nursing ,,Lecturer ,,Health Sciences"Radhakrishnan,Dhenuka K ",BSc Queen's; MD Univ of Toronto ,Paediatrics ,,Assistant Professor/MD ,,Schulich"Radin,Daniel A ","BS, Univ of Windsor; MD, Univ of Toronto ",Department of Medicine/Schulich - Education Office ,,Adjunct/MD ,,Schulich"Rafat,Yasaman ",BA Univ of Torontooronto ,Modern Languages & Literatures ,,Assistant Professor ,,Arts & Humanities"Ragogna,Paul J. ",BSc Brock; Ph.D. Dalhousie ,Chemistry ,,Associate Professor ,,Science"Rahman,Adam ","BS, Memorial Univ, NF; MD, Memorial Univ, NF ",Department of Medicine ,,Assistant Professor/MD ,,Schulich"Rahman,Quazi Mehbubar ","BSc Dhara University Bangladesh, Ph.D. U of Calgary ",Electrical & Computer ,,Assistant Professor ,,Engineering"Rahman,Riffat-Ur ",MBBS Punjab Univ Pakistan ,Paediatrics/Schulich - Education Office ,,Adjunct/MD ,,Schulich"Railton,Craig J ",FRCPCan MD FRCPCan at TORONTO ; BSc at Western ,Anesthesia-Perioperative Med/Department of Medicine ,,Assistant Professor/MD ,,Schulich"Raine,Michael ","BA, Univ of Warwick; Ph.D. Univ of Iowa ",Film Studies ,,Assistant Professor ,,Arts & Humanities"Rainhard,Darren S. ","MART, Western ",Sociology ,,Lecturer ,,Social Science"Rajabalee,Mahmud A ","MB BCh Ainshams Univ, EGY ",Department of Medicine ,,Adjunct/MD ,,Schulich"Rajakumar,Nagalingam ",MBBS at PERADENIYA ; MSc Ph.D. at Western ,Anatomy & Cell Biology/Psychiatry ,,Associate Professor ,,Schulich"Rajan,Tilottama ","BA, MA, Ph.D. Toronto; ",English ,Theory&Criticism ID Grad Prog ,Professor ,,Arts & Humanities"Rajgopal,Chellappa ",FRCS ENG FRCS EDIN FRCSCan MBBS at OSMANIA ,Surgery ,,Associate Professor/MD ,,Schulich"Ralley,Fiona E. ",BSc MBChB at EDINBURGH ,Anesthesia-Perioperative Med ,,Professor/MD ,,Schulich"Ralph,Edward D ",FRCPCan BSc MD at Western ,Department of Medicine ,,Professor/MD ,,Schulich"Ram,Ganesh ",MD U of Calgary ,Family Medicine - General ,,Adjunct/MD ,,Schulich"Ramanarayanan,Ananth ",BA U of Chicago; Ph.D. U of Minnesota ,Economics ,,Assistant Professor ,,Social Science"Ramirez,Alvaro ","MD, Laval Univ, QC ",Surgery ,,Adjunct/MD ,,Schulich"Ramsay,David ",FRCPCan MBChB at GLASGOW ; BSc at LONDON ; DPhil at OXFORD ,Clinical Neurological Science/Pathology ,,Professor/MD ,,Schulich"Ramsewak,Winston ",MBBS at WEST INDIES ; BSc at WINNIPEG ,Department of Medical Imaging/Schulich - Education office ,,Adjunct/MD ,,Schulich"Randall,Marilyn ","BA, Ph.D. Toronto; MA Laval; ",French Studies ,,Professor ,Department Chair ,Arts & Humanities"Randall,Melanie ","BA ; LLB, MA Toronto; Ph.D. York; ",Law - Office of the Dean ,,Associate Professor ,,Law"Ranger,Adrianna ",BS at GUELPH ; MD at MCMASTER ; FRCSCan at OTTAWA ; FRCSCan at Western ,Clinical Neurological Science/Paediatrics/Surgery ,,Associate Professor/MD ,,Schulich"Ranjit,Ebenezer V ",MD at MADRAS ,Family Medicine - General/Schulich - Education Office ,,Adjunct/MD ,,Schulich"Rankin,Richard N ",FRCR FRCPCan MBChB at ST. ANDREWS ,Department of Medical Imaging ,,Professor Emeritus ,,Schulich"Rankin,Stuart A ","Degree Saskatchewan, Ph.D. U of Ottawa ",Mathematics ,,Associate Professor ,,Science"Rao,Jay ",MRCPsy FRCPCan DPM at BANGALORE ; MBBS at MYSORE ,Psychiatry ,,Associate Professor/MD ,,Schulich"Rao,Raveendra ","Bachelors, Ph.D. India Inst of Technology ",Electrical & Computer ,,Associate Professor ,,Engineering"Rao,Shanti ",BS Simon Fraser BC; MD U of Calgary ,Family Medicine - General/Schulich - Education Office ,,Adjunct/MD ,,Schulich"Rashed,Nashed ",MBBCh at AIN SHAMS ,Paediatrics/Schulich - Education Office ,,Adjunct/MD ,,Schulich"Ratcliffe,Marjorie E ",BA Carleton; MA Alberta; Ph.D. Toronto; ,Modern Languages & Literatures/Womens' Studies ,,Professor ,,Arts & Humanities"Ravid,Anat ",MD Israel ,Surgery/Schulich - Education Office ,,Adjunct/MD ,,Schulich"Rawlins,Jenna R ",BSc/MD Western ,Obstetrics & Gynaecology/Schulich - Windsor Campus/Schuli ,,cAdjunct/MD ,Course Coordinator ,Schulich"Ray,Ajay Kumar ","BSc, BTech, MTech, India; Ph.D., Minneapolis; ",Chemical &Biochem Engineering ,,Professor ,,Engineering"Ray,Madhumita Bhowmick ","BSc, BTech, MTech, India; Ph.D., Minneapolis; ",Chemical &Biochem Engineering ,,Professor ,,Engineering"Ray,Reema ","BSM, Univ of Calcutta; MD, Utkal Univ, IND ",Family Medicine - General ,,Adjunct/MD ,,Schulich"Ray,Susan Lynn ","BScN, RegN Toronto; MScN Western; Ph.D. Alberta ",Nursing ,,Associate Professor ,,Health Sciences"Rayner,Mark A ",BA/MA Ontario ,Info & Media Studies - General ,,Lecturer ,,Information & Media Studies"Rayner,Wesley B ","BA, LLB, OF THE LAW SOCIETY OF UPPER CANADA ; LLM Yale; ",Law - Office of the Dean ,,Professor Emeritus ,,Law"Raynor,Charys Megan ","BSc., Western; MSc., Western ",Anatomy & Cell Biology ,,Lecturer ,,Schulich"Razvi,Hassan A ",FRCSCan MD at SASKATCHEWAN ,Surgery ,,Professor/MD ,Division Chair ,Schulich"Read,Nancy ",FRCP MD at DALHOUSIE ; BSc at MOUNT ALLISO ,Oncology ,,Associate Professor/MD ,,Schulich"Reaume-Zimmer,Paula ",BScN at WINDSOR ,Psychiatry - Ext Camp Program ,,Lecturer ,,Schulich"Rebeiro-Gruhl,Karen ","BSc, MSc Western ",Occupational Therapy ,,Adjunct Clinical Professor ,,Health Sciences"Rebel,Margaretha ",FRCSCan MD at MCMASTER ; MEd at TORONTO ,Schulich - Office of the Dean/Obstetrics & Gynaecology ,,Professor/MD ,Department Chair ,Schulich"Rechnitzer,Peter ","BA, MD; FRCPCan ",Department of Medicine ,,Clinical Professor Emeritus ,,Schulich"Reddon,John ",DDS at MCGILL ,Dental Clinics ,,Adjunct Clinical Professor ,,Schulich"Reddy,Natalie ","BSc., Univ of Toronto; MD, Western ",Obstetrics & Gynaecology ,,Adjunct/MD ,,Schulich"Reddy,Ramesh ",BSc McMaster; MD Western ,Department of Medicine ,,Assistant Professor/MD ,,Schulich"Redekop,Ernest H ","BA Manitoba; MA, Ph.D. Toronto; ",English ,,Professor Emeritus ,,Arts & Humanities"Redigonda,Lui G ",BSc DDS at Western ,Graduate Orthodontics ,,Adjunct Clinical Professor ,,Schulich"Reed,John Richard ",BA New York Univ ,Info & Media Studies - General ,,Lecturer ,,Information & Media Studies"Reesor,R. Mark ","BSc McGill; MMATH, Ph.D. Waterloo; ",Applied Mathematics ,,Associate Professor ,,Science"Regan,Kelly Ann ",CCFP CCFP(EM) BSc MD at Western ,Department of Medicine/Family Medicine - General ,,Associate Professor/MD ,,Schulich"Regan,Sandra ","BS (Nursing) U of Victoria, MS (Nursing) UBC ",Nursing ,,Assistant Professor ,,Health Sciences"Regnault,Timothy R ",Ph.D. at COLORADO ,Physiology and Pharmacology/Obstetrics & Gynaecology ,,Associate Professor ,,Schulich"Rehman,Faisal ",FRCPCan BSc at ALBERTA ; MD at Queen's ,Department of Medicine/Schulich - Education Office ,,Associate Professor/MD ,,Schulich"Rehmann,Lars ","Diplom Biotechnologie T.U. Braunschweig Germany, Ph.D. Queen's ",Chemical &Biochem Engineering/The Institute of Chem & Fuels ,,Assistant Professor ,,Engineering"Reichert,Sonja Maria ","BS, Univ of Waterloo; MD, McMaster Univ ",Family Medicine - General ,,Assistant Professor/MD ,,Schulich"Reid,David Brian ","BScN (Hon), MScN, Toronto; ",Nursing ,,Lecturer ,,Health Sciences"Reid,Graham James ",MA Ph.D. at BOWLING GRN ; BA at Western ,Psychology ,Paediatrics/Family Medicine ,Associate Professor ,,Social Science"Reid,Gregor ",BSc at GLASGOW ; Ph.D. at MASSEY ,Microbiology & Immunology/Surgery ,,Professor ,,Schulich"Reid,Gregory J. ","BA New Zealand, Ph.D. U of Waikato New Zealand ",Applied Mathematics ,,Professor ,,Science"Reid,Helen M. ","BA, MA Ontario ",Education - Preservice Office and Continuing Educ ,,Lecturer ,,Education"Reid,Laura K ","BA Ontario, MA Western ",Computer Science ,,Lecturer ,,Science"Reid,Meghan L ",BSc DDS at DALHOUSIE ,Dental Clinics ,,Adjunct Clinical Professor ,,Schulich"Reid,Robert ",FRCPCan MBChB at GLASGOW ,Department of Medical Imaging ,,Associate Professor/MD ,,Schulich"Reilly,Elizabeth Anne ","BA, MA Ontario ",Education - Preservice Office ,,Lecturer ,,Education"Reimer,Alvin ","Bachelors, Univ of Waterloo ",Music - Office of the Dean ,,Professor Emeritus ,,Music"Reis,Clive M. ","MA, Oxford; Ph.D. Michigan State ",Mathematics ,,Professor Emeritus ,,Science"Reiss,Jeffrey ",MD FRCPCan at MANITOBA ,Psychiatry ,,Professor/MD ,Vice Chair ,Schulich"Reitzel-Jaffe,Deb ","BA, MA, Ph.D. Western ",Psychology ,,Adjunct Clinical Professor ,,Social Science"Ren,Jiandong ","BSc, MSc Southwest Jiaotong (China); Ph.D. Temple; ",Statistics & Actuarial Science ,,Associate Professor ,,Science"Renner,Lex ","BSc Saskatchewan; MSc, Ph.D. British Columbia; ",Mathematics ,,Professor ,,Science"Reno,Mark David ","BA Minsk State Ling Univ BLR, MART Western ",Business - Associate Dean ,,Assistant Professor ,,Ivey"Rerup,Claus ","BA, MS, Ph.D. Aarhus School of Business; ",Business - Associate Dean ,,Associate Professor ,,Ivey"Reuber,Grant ","BA Western, Ph.D. Harvard ",Economics ,,Honorary Professor ,,Social Science"Reurekas,Briane ","BA, MA Ontario ",Nursing ,,Lecturer ,,Health Sciences"Reyhani-Masoleh,Arash ","BSc, MSc, Tehran; Ph.D., Waterloo; ",Electrical & Computer ,,Associate Professor ,,Engineering"Reynard,Pierre C. ","BA, MA, Ph.D. York ",History ,,Associate Professor ,,Social Science"Reynolds,Jennifer ","BA, Univ of Ottawa; MART, Western ",Sociology ,,Lecturer ,,Social Science"Reynolds,Richard P ",FRCPCan FRCPCan MD at Queen's ; MSc at TORONTO ,Department of Medicine ,,Professor/MD ,,Schulich"Rezai-Rashti,Goli M. ","BA National Univ. of Iran; MA, Ph.D. Toronto; ",Education - Office of the Dean ,,Professor ,,Education"Rhoden,Nancy L ","BA, MA, Ph.D. Princeton ",History ,,Associate Professor ,,Social Science"Riaz,Amber Fatima ","BA and Ph.D., Western ",English ,,Assistant Professor ,,Arts & Humanities"Ribbink,Dina ",MS U of Maastricht; Ph.D. U of Maryland ,Business - Associate Dean ,,Assistant Professor ,,Ivey"Ricard,Suzanne ","BA, MA Ontario ",Sociology ,,Assistant Professor ,,Social Science"Rice,Charles L ",BSc at ACADIA ; MSc at SASKATCHEWAN ; Ph.D. at Western ,Kinesiology - General ,Anatomy & Cell Biology ,Professor ,,Health Sciences"Rice,George P A ","BSc, MD Alberta; FRCPCan ",Clinical Neurological Science ,,Professor Emeritus ,Clinical Department Chair ,Schulich"Richard,Julie ",BS Carleton Univ; MD U of Ottawa ,Psychiatry ,,Assistant Professor/MD ,,Schulich"Richards,Crispen ",MD at DALHOUSIE ; FRCP at MCMASTER ; BESc at NEW BRUNSWIC ,Department of Medicine ,,Assistant Professor/MD ,,Schulich"Richards,Judy Lynn ",BS U of Guelph; Ph.D. Western ,Sociology ,,Adjunct Research Professor ,,Social Science"Richards,Robert S. ",FRCSCan MD at SASKATCHEWAN ,Surgery ,,Associate Professor/MD ,,Schulich"Richardson,Barbara Joan ","BA and Ph.D., Western ",Psychology ,,Adjunct Clinical Professor ,,Social Science"Richardson,Bryan S ",FRCSCan MD at Western ,Paediatrics/Obstetrics & Gynaecology/Physiology and Pharm ,,aProfessor/MD ,,Schulich"Richardson,Christine Ann ",MD at Western ; OD BSc at WATERLOO ,Department of Medicine/Family Medicine - General ,,Associate Professor/MD ,,Schulich"Richardson,Colleen ",BMUS (Ed) Brandon; DMA Cincinnati College-Conservatory ,Music - Office of the Dean ,,Associate Professor ,,Music"Richardson,J Donald ",FRCPCan MD at Queen's ,Psychiatry ,,Adjunct/MD ,,Schulich"Richardson,Janet Isabel ",EMBA Western; RN Conestoga ,Nursing ,,Adjunct Assistant Professor ,,Health Sciences"Richert,Frances Mary ","BSc Ottawa, MSc Western; ",Comm. Disorders-Clinics ,,Lecturer ,,Health Sciences"Richmond,Chantelle ","BA, MA McMaster; Ph.D. McGill ",Geography/First Nations Studies Program ,,Assistant Professor ,,Social Science"Richmond,Jeffrey H ",DDS FRCDC BSc at Western ,Paediatrics/Dental Clinics ,,Adjunct Clinical Professor ,,Schulich"Riddell-Dixon,Elizabeth ","BA, Ph.D. Toronto; MSc London; ",Political Science ,,Professor Emeritus ,,Social Science"Riddell,Thelma Irene ","RN, COHN(C), MScN; ",Nursing ,,Lecturer ,,Health Sciences"Ridley,Jane ","BA, MA Ontario ",Nursing ,,Adjunct Associate Professor ,,Health Sciences"Rieder,Michael J ",FRCPCan MD at SASKATCHEWAN ; Ph.D. at TORONTO ,Department of Medicine/Physiology and Pharmacology/Schu ,,Professor/MD ,,Schulich"Riedstra,Lutzen H ","BA, Univ of Waterloo ",Info & Media Studies - General ,,Lecturer ,,Information & Media Studies"Riehl,Eugena Denise ","BA, MA, Ph.D. ; ",Music - Research & Composition ,,Lecturer ,,Music"Riel,Christiane ",Diploma Hec Montreal ,Music - Performance Studies ,,Lecturer ,,Music"Rigby,Megan Cheryl ",BSc MD at Western ,Family Medicine - General ,,Adjunct/MD ,,Schulich"Riley,David Michael ","Bachelors, Ph.D. U of Alberta ",Mathematics ,,Professor ,,Science"Riley,Liam John ",Diploma Hec Montreal ,Geography ,,Lecturer ,,Social Science"Rinehart,James W ","BA, MA Michigan State; Ph.D. Ohio State; ",Sociology ,,Professor Emeritus ,,Social Science"Rip,Jack ",BSc MSc at GUELPH ; Ph.D. at PURDUE ,Clinical Biochemistry ,,Assistant Professor ,Course Coordinator ,Schulich"Riseling,Robert A. ",BMED Illinois Wesleyan; DMA Michigan; MMUS Texas; ,Music - Office of the Dean ,,Professor Emeritus ,,Music"Ritchie,Hendrica Leslie ","BA, Huron College, Western; MD, McMaster Univ ",Psychiatry ,,Adjunct/MD ,,Schulich"Rivers,David ","BS Vanderbilt Univ; MS, Ph.D. U of Wisconsin ",Economics ,,Assistant Professor ,,Social Science"Rivers,Emilie McHugh ",BA Georgetown U; MS U of Wisconsin-Madison USA ,Economics ,,Lecturer ,,Social Science"Rizkalla,Amin S. ","BSc, Cario; MEng, McGill; Ph.D., Dalhousie; P.Eng. ",Chemical &Biochem Engineering ,Medical Biophysics/Dentistry ,Associate Professor ,,Engineering"Rizkalla,Kamilia S ",FRCPCan MD at ASSIUT ,Pathology ,,Professor/MD ,,Schulich"Rizvi,Syed Naveed ",MBBS FRCPCan MBBS at KARACHI ,Psychiatry ,,Associate Professor/MD ,,Schulich"Roach,Margot R ",BA NB; Ph.D. ON ,Medical Biophysics ,,Professor Emeritus ,,Schulich"Robb,Ryan Douglas ","BA, MA Ontario ",Philosophy ,,Assistant Professor ,,Arts & Humanities"Roberts-South,Angela Christine ","BA, MA Ontario ",Communicative Sci & Disorders ,,Lecturer ,,Health Sciences"Roberts,Alfred E ",MD at MCGILL ; BSc at Western ,Anesthesia-Perioperative Med/Schulich - Education Office ,,Adjunct/MD ,,Schulich"Roberts,Glen Gordon ",BSc Western ,Soc Science - Office of Dean ,,Adjunct Research Professor ,,Social Science"Roberts,Nancy M ","BA, MA Ohio ",Classical Studies ,,Lecturer ,,Arts & Humanities"Roberts,Sharon Ellen ",BFA Western ,Sociology ,,Adjunct Research Professor ,,Social Science"Roberts,William A ","BS Maryland; MA, Ph.D. Bryn Mawr; ",Psychology ,,Adjunct Research Professor/Professor Emeritus ,,Social Science"Robertson,Darroch A ","BA, MBA, Ph.D. Western; CMA Ontario; ",Business - Associate Dean ,,Associate Professor ,,Ivey"Robertson,Gail C ",BA Georgetown U; MS U of Wisconsin-Madison USA ,Bachelor of Mgmt & Org Studies ,,Lecturer ,,Social Science"Robertson,James M ",DVM Univ of Toronto; MSc U of Pennsylvania ,Epidemiology and Biostatistics ,,Professor Emeritus ,,Schulich"Robertson,Kirsty ","BA Bishops; MA, Ph.D. Queen's; ",Visual Arts ,,Assistant Professor ,,Arts & Humanities"Robin,Alena ","BA McGill, Ph.D. Univ Nacional Autonoma de Mexico ",Modern Languages & Literatures ,,Assistant Professor ,,Arts & Humanities"Robins,Ronald Norman ",FRCSCan MD at Western ,Obstetrics & Gynaecology ,,Associate Professor/MD ,,Schulich"Robinson,Christopher ","BSc, MSc London; Ph.D. Chicago; CIBC Director ",Economics ,,Professor ,,Social Science"Robinson,Clare ",BE and Ph.D. Univ of Queen'sland Australia ,Civil & Environmental ,,Assistant Professor ,,Engineering"Robinson,Daniel ","BA Carleton; MA, Ph.D. York; ",Info & Media Studies - General ,,Associate Professor ,,Information & Media Studies"Robinson,Helena M ",CCFP at Queen's ; MD FCFPC at Western ,Family Medicine - General ,,Adjunct/MD ,,Schulich"Robinson,Irvine J ","BA, MSc Queen's; Ph.D. ; ",Mathematics ,,Professor Emeritus ,,Science"Robson,Arthur J ",BSc Victoria U of Wellington; Ph.D. MIT; ,Economics ,,Professor Emeritus ,,Social Science"Rodenhiser,David Ivan ",BSc MSc at ACADIA ; Ph.D. at Western ,Clinical Biochemistry/Oncology/Paediatrics ,,Associate Professor ,,Schulich"Rodenhurst,Mary ",MSW at MICHIGAN ; BA BSW at WINDSOR ,Psychiatry ,,Lecturer ,,Schulich"Rodger,Judith Marian ",BA McGill Univ ,Visual Arts ,,Adjunct Research Professor ,,Arts & Humanities"Rodger,N Wilson ","BSc, BSc, MD Manitoba; FRCPCan ",Department of Medicine ,,Professor Emeritus ,,Schulich"Rodger,Susan Christine ","BA Laurier; MA, Ph.D. ; ",Education - Office of the Dean ,,Associate Professor ,,Education"Rodrigues,George Boris ",BSc at MCMASTER ; MD at Queen's ,Oncology/Epidemiology and Biostatistics ,,Associate Professor/MD ,,Schulich"Rodrigues,Jude F ","MBBS U of Bombay, India ",Department of Medicine ,,Adjunct/MD ,,Schulich"Roe,Michael John ",MD at TORONTO ; BSc FRCSCan at Western ,Obstetrics & Gynaecology/Schulich - Education Office ,,Adjunct/MD ,,Schulich"Roebotham,Roy W ",CCFP CCFP(EM) FCFPC MD at MEMORIAL ,Department of Medicine ,,Associate Professor/MD ,,Schulich"Roendigs,Oliver ",,Mathematics ,,Assistant Professor ,,Science"Roffey,Peggy ","BA, Ph.D. Ontario ",English ,,Assistant Professor ,,Arts & Humanities"Rogan,Peter ",BA at JOHN HOPKINS ; Ph.D. at YALE ,Biochemistry ,Computer Science ,Professor ,,Schulich"Rogers,John M ",FRCPCan MD at DALHOUSIE ,Department of Medical Imaging ,,Associate Professor/MD ,,Schulich"Rogers,Kem ",BSc MSc at OTTAWA ; Ph.D. at TORONTO ,Anatomy & Cell Biology ,,Professor ,,Schulich"Rogers,Lawrence Wayne ",MSc Western; DDS Western ,Dentistry ,,Adjunct Clinical Professor ,,Schulich"Rohani,Sohrab ","BSc, Shiraz-Iran; Ph.D., Wales; P.Eng. ",Chemical &Biochem Engineering ,,Professor ,,Engineering"Rohekar,Gina ",FRCPCan FRCPCan BSc at Queen's ; MD at Western ,Department of Medicine ,,Assistant Professor/MD ,,Schulich"Rohekar,Sherry ",FRCPCan FRCPCan BSc at Queen's ; MD at Western ,Department of Medicine ,,Assistant Professor/MD ,,Schulich"Roland-Wieczorek,Sophie L. ","BMus Laurier; MA, MMus Western; DM in progress Indiana; ",Music - Office of the Dean ,,Associate Professor ,Department Chair ,Music"Rollman,Gary B ","BA Rochester; MA, Ph.D. Pennsylvania; ",Psychology ,,Adjunct Research Professor/Professor Emeritus ,,Social Science"Romagnoli,Cesare ",MD ,Department of Medical Imaging ,,Associate Professor/MD ,,Schulich"Roman,John Samuel ","DDS, Western ",Dental Clinics ,,Adjunct Clinical Professor ,,Schulich"Romane,Leeanne m ","BA, Simon Fraser Univ, BC; MA, UBC ",Info & Media Studies - General ,,Lecturer ,,Information & Media Studies"Romano,Walter M ",FRCPCan MD at Western ,Diagnost Radiol & Nuclear Med/Obstetrics & Gynaecology ,,Associate Professor/MD ,,Schulich"Romanson,Paul C ",DDS BSc at Western ,Dental Clinics ,,Adjunct Clinical Professor ,,Schulich"Romsa,Jonathan ",MD FRCPCan at Western ; BSc at WINDSOR ,Department of Medical Imaging ,,Associate Professor/MD ,,Schulich"Romsa,Nancy ",MD at TORONTO ; BSc at WINDSOR ,Department of Medicine/Schulich - Education Office ,,Adjunct/MD ,,Schulich"Roopchand-Mohammed,Rupa Roma ",FRCPCan BSc MBBS at WEST INDIES ,Psychiatry - Ext Camp Program ,,Adjunct/MD ,,Schulich"Rorabeck,Cecil H ",MD; FRCSCan ,Surgery ,,Professor Emeritus ,,Schulich"Rosati,Peter A ",Masters Ontario ,Civil & Environmental ,,Professor Emeritus ,,Engineering"Rose,Graham ","BSC., Ph.D., Birmingham ",Physics and Astronomy ,,Professor Emeritus ,,Science"Rosen,Clifford ",BS Witwatersrand Med Sch ZMB ,Anesthesia-Perioperative Med/Schulich - Education Office ,,Adjunct/MD ,,Schulich"Rosen,Daniel ","BMSA, Western ",Music - Research & Composition ,,Lecturer ,,Music"Rosen,Ellen Lynne Strauss ",BScN at MCGILL ; MSc at Western ,Paediatrics ,,Lecturer ,,Schulich"Rosenberg,Herschel Charles ",FRCPCan FRCPCan at TORONTO ; MD MEd at Western ,Paediatrics ,,Associate Professor/MD ,,Schulich"Rosner,S.David ",Ph.D. Harvard USA ,Physics and Astronomy ,,Professor Emeritus ,,Science"Ross,Catherine L ","BA, MLS, Ph.D. Western; MA Toronto; ",Info & Media Studies - General ,,Professor Emeritus ,,Information & Media Studies"Ross,David Somerville ","HBA, Western ",Business - Associate Dean ,,Lecturer ,,Ivey"Ross,Douglas ",FRCSCan MEd at TORONTO ; BSc MD at UBC ,Surgery ,,Professor/MD ,Division Chair ,Schulich"Ross,Greggory Macintosh ","BA, Mount Allison, NB; MAS, Sainta Mary's Univ, NS ",Kinesiology-Office of Director ,,Lecturer ,,Health Sciences"Ross,Ian G. ",FRCPCan BSc at MCGILL ; MD at Queen's ,Department of Medical Imaging ,,Associate Professor/MD ,,Schulich"Ross,James W ","BA, Univ of King's College, NS; MD, McMaster Univ ",Psychiatry ,,Assistant Professor/MD ,,Schulich"Ross,Kristina G ","BA, New York Univ; JD, City Univ of New York, USA ",Law - Office of the Dean ,,Professor ,,Law"Ross,Sarah Jane ","BA, MART UWO ",Psychology ,,Lecturer ,,Social Science"Ross,Shelley ","BS, Univ of Victoria, BC; Ph.D. Univ of Victoria, BC ",Family Medicine - General ,,Adjunct Assistant Professor ,,Schulich"Rossiter,Margaret Ruth ","BA, MART Western ",Education - Graduate Education ,,Lecturer ,,Education"Roszell,Sheri Lee ","BS, Univ of Waterloo; MD, Memorial Univ, NL ",Family Medicine - General ,,Adjunct/MD ,,Schulich"Rotenberg,Brian W ",FRCPCan MD at TORONTO ; BSc at YORK ,Otolaryngology/Epidemiology and Biostatistics ,,Assistant Professor/MD ,Centre Director/Associate Chair ,Schulich"Roth,James Hubert ",FRCSCan MD at Western ,Surgery ,,Professor/MD ,Division Chair ,Schulich"Roth,Kathryn Elizabeth ",BS Queen's U; MD Western ,Otolaryngology ,,Assistant Professor/MD ,,Schulich"Roth,Leah ",BA U of Southern California; Ph.D. U of Southern California ,French Studies ,,Lecturer ,,Arts & Humanities"Rothbauer,Paulette Margaret ","BA Toronto; MLIS, Ph.D. Western; ",Info & Media Studies - General ,Womens' Studies ,Associate Professor ,,Information & Media Studies"Rothstein,Mitch ","BA Waterloo, MA, Ph.D. ",Bachelor of Mgmt & Org Studies ,,Professor ,,Social Science"Roukema,Henry W ",MSc at TORONTO ; MD at Western ,Paediatrics ,,Associate Professor/MD ,,Schulich"Roulston,Christine M ","BA Southampton; MA, Ph.D. Toronto; ",French Studies/Womens' Studies ,,Professor ,,Arts & Humanities"Rouse,Michael J ","BA, MA, Ph.D. Calgary; ",Epidemiology and Biostatistics ,Business - Associate Dean ,Assistant Professor ,,Schulich"Rovis,Katarina ","Masters, Professional HRV ",Paediatrics ,,Adjunct Professor ,,Schulich"Rowe,Glenn ","BComm, MBA Memorial; Ph.D. Texas, A & M; ",Business - Associate Dean ,,Associate Professor ,,Ivey"Rowlinson,Matthew ","BA, MA Toronto; MA, Ph.D. Cornell; ",English ,,Professor ,,Arts & Humanities"Rrafshi,Luli ","MD, Univ of Medicine GR, ROMANIA ",Family Medicine - General ,,Adjunct/MD ,,Schulich"Rubaiyyat,Tania ",MBBS ,Family Medicine ,,Adjunct/MD ,,Schulich"Rubin,Benjamin ","BSc McGill; MSc, Ph.D. SUNY (Syracuse) ",Biology ,,Assistant Professor ,,Science"Rubin,Victoria ","BA Kharkov (Ukraine); MA, Ph.D. Syracuse; ",Info & Media Studies - General ,,Assistant Professor ,,Information & Media Studies"Ruby,Ralph F ",FRCSCan BA MD at Western ,Otolaryngology ,,Professor Emeritus ,,Schulich"Rudman,Debbie ",BSc(OT) Toronto; MSc Western; Ph.D. Toronto ,Occupational Therapy ,Womens' Studies ,Associate Professor ,,Health Sciences"Rudnick,Abraham ",MD at JERUSALEM ; Ph.D. at TEL-AVIV ,Nursing ,,Adjunct Research Professor ,,Health Sciences"Rudolph,Kathleen ","BM, MM DMA Catholic; ",Music - Performance Studies ,,Assistant Professor ,,Music"Rudrick,Brian ",MD at SASKATCHEWAN ,Pathology ,,Adjunct/MD ,,Schulich"Ruffo,Sebastien ","BA, Univ de Montreal, QC; Ph.D. Univ de Montreal ",French Studies ,,Assistant Professor ,,Arts & Humanities"Rui,Tao ",Professional China; Ph.D. Shanghai Medical Clinic ,Department of Medicine ,,Adjunct Research Professor ,,Schulich"Rule,James W. ","BA, MA Ontario ",Education - Continuing Educ ,,Lecturer ,,Education"Rupar,Charles Anthony ",BSc Ph.D. at Western ,Paediatrics/Clinical Biochemistry ,,Associate Professor ,Clinic Director/Division Chair ,Schulich"Ruscher,Susan M. ","MA, Ph.D. Western ",Psychology ,,Adjunct Clinical Professor ,,Social Science"Rushlow,Walter James ",BSc MSc Ph.D. at Western ,Anatomy & Cell Biology/Psychiatry ,,Associate Professor ,,Schulich"Ruthes Coelho,Trina Trisevgeni ","HBA, Western ",Business - Associate Dean ,,Lecturer ,,Ivey"Rutledge,John Thomas ","BA, B Ed Western ",Education - Office of the Dean ,,Professor Emeritus ,,Education"Rutledge,Sharon Marie ","BS, MD Western ",Obstetrics & Gynaecology/Schulich - Education Office ,,Adjunct/MD ,,Schulich